Tweets,Retweets,Likes,Date,Cleaned_Tweets,Subjectivity,Polarity,Sentiment
@obaidomer @Liv_Boeree True,76,1816,2022-06-10 05:20:51,True,0.65,0.35,Positive
@mn_google @georgegalloway @Twitter @verified Noooo!,108,2355,2022-06-10 04:43:56,Noooo!,0.0,0.0,Neutral
@georgegalloway @Twitter @verified прости товарищ,685,8493,2022-06-10 04:41:12,прости товарищ,0.0,0.0,Neutral
@teslaownersSV @Tesla We’re going deep on roundabouts! Should get noticeably better with 10.13.,925,23348,2022-06-10 04:37:22,We’re going deep on roundabouts! Should get noticeably better with 10.13.,0.45,0.25,Positive
@RenataKonkoly @danielcrosby I heard Top Gun 2 is good. Will check it out.,822,10063,2022-06-09 19:29:48,I heard Top Gun 2 is good. Will check it out.,0.55,0.6,Positive
@danielcrosby There’s something special about enjoying movies in a theater with total strangers. I hope that never goes away.,3467,24890,2022-06-09 19:24:50,There’s something special about enjoying movies in a theater with total strangers. I hope that never goes away.,0.6404761904761904,0.28571428571428575,Positive
@RenataKonkoly @danielcrosby Doctor Strange in the Multiverse of Madness,734,9288,2022-06-09 19:19:22,Doctor Strange in the Multiverse of Madness,0.15,-0.05,Negative
@danielcrosby I don’t even care if it lowers my life expectancy,425,8580,2022-06-09 19:16:33,I don’t even care if it lowers my life expectancy,0.0,0.0,Neutral
"@danielcrosby Diet Coke is amazing, especially the soda fountain version at movie theaters with salt &amp; butter popcorn",3925,62450,2022-06-09 19:14:58,"Diet Coke is amazing, especially the soda fountain version at movie theaters with salt &amp; butter popcorn",0.95,0.30000000000000004,Positive
"@TrungTPhan If the average length of a tweet (minus headers) is ~100 bytes of text, that’s only 50GB. You could fit it on a USB stick.",2555,71364,2022-06-09 16:43:39,"If the average length of a tweet (minus headers) is ~100 bytes of text, that’s only 50GB. You could fit it on a USB stick.",0.475,0.037500000000000006,Positive
@RobHerring @OANN Only Twitter,2268,55535,2022-06-09 16:38:50,Only Twitter,1.0,0.0,Neutral
@kchau @Tesla @WholeMarsBlog @SawyerMerritt Glad they’re ok,513,21636,2022-06-09 16:24:37,Glad they’re ok,0.75,0.5,Positive
@WholeMarsBlog My diabolical plan is coming together!,2925,56729,2022-06-08 18:03:10,My diabolical plan is coming together!,0.0,0.0,Neutral
"@historydefined If little red riding hood was on psychedelics, this whole story makes a ton of sense",543,10175,2022-06-08 08:59:57,"If little red riding hood was on psychedelics, this whole story makes a ton of sense",0.3,0.00416666666666667,Positive
"@jeremychrysler @Tesla We will look into this &amp; adjust. In general, I’d recommend against using recirc, as the range advantage is small.",222,4144,2022-06-08 02:34:58,"We will look into this &amp; adjust. In general, I’d recommend against using recirc, as the range advantage is small.",0.45,-0.09999999999999999,Negative
@historydefined Seems odd that anyone would mistake a talking wolf for their grandmother. What sort of octave range does that wolf have anyway!?,1816,38457,2022-06-08 02:23:14,Seems odd that anyone would mistake a talking wolf for their grandmother. What sort of octave range does that wolf have anyway!?,0.25,-0.20833333333333331,Negative
@Rainmaker1973 I think I saw these in Elden Ring,1221,39752,2022-06-07 20:14:10,I think I saw these in Elden Ring,0.0,0.0,Neutral
@EvaFoxU True haha,222,5849,2022-06-07 16:24:22,True haha,0.475,0.275,Positive
"@OwenSparks_ Yeah, exactly. Also, other companies are using the Tesla name for solar and Powerwall. Will put a stop to that.",919,26199,2022-06-07 15:37:10,"Yeah, exactly. Also, other companies are using the Tesla name for solar and Powerwall. Will put a stop to that.",0.3125,0.0625,Positive
YouTube seems to be nonstop scam ads,47117,635286,2022-06-07 15:32:30,YouTube seems to be nonstop scam ads,0.0,0.0,Neutral
@teslaownersSV @PPathole It looks like the future,446,8488,2022-06-07 14:51:18,It looks like the future,0.125,0.0,Neutral
@PPathole cgi irl,184,4475,2022-06-07 14:51:01,cgi irl,0.0,0.0,Neutral
@PPathole It will be our best product ever imo,3253,92106,2022-06-07 01:59:48,It will be our best product ever imo,0.3,1.0,Positive
"What resolution is life in, 8k? – SJM",7704,147849,2022-06-06 17:05:47,"What resolution is life in, 8k? – SJM",0.0,0.0,Neutral
@realMeetKevin Correct,1729,39507,2022-06-06 15:52:34,Correct,0.0,0.0,Neutral
"@realchrisrufo @Liv_Boeree There are still some great journalists at WaPo, but the trend is super bad",848,11652,2022-06-06 15:33:16,"There are still some great journalists at WaPo, but the trend is super bad",0.6944444444444443,0.1444444444444445,Positive
"@BBC_Future Most people still think China has a one-child policy. 

China had its lowest birthdate ever last year, despite having a three-child policy!

At current birth rates, China will lose ~40% of people every generation!

Population collapse.",6930,65902,2022-06-06 13:11:14,"Most people still think China has a one-child policy. China had its lowest birthdate ever last year, despite having a three-child policy!At current birth rates, China will lose ~40% of people every generation!Population collapse.",0.32222222222222224,0.16666666666666666,Positive
@PPathole Romeo and Juliet,296,6188,2022-06-06 02:16:43,Romeo and Juliet,0.0,0.0,Neutral
If chess was released as a video game https://t.co/8SuK8Mg7yT,19593,285771,2022-06-06 01:17:17,If chess was released as a video game,0.4,-0.4,Negative
@EvaFoxU @WholeMarsBlog Such a dapper fellow!,140,3156,2022-06-06 01:10:37,Such a dapper fellow!,0.5,0.0,Neutral
The acid test for any two competing socioeconomic systems is which side needs to build a wall to keep people from escaping? That’s the bad one!,19114,172667,2022-06-06 01:06:53,The acid test for any two competing socioeconomic systems is which side needs to build a wall to keep people from escaping? That’s the bad one!,0.6666666666666666,-0.8749999999999998,Negative
"Realized what I have in common with environmentalists, but also why they’re so annoyingly wrong: 

They are conservationists of what is, whereas they should be conservationists of our potential over time, our cosmic endowment.

(From a friend)",6308,80813,2022-06-06 00:25:51,"Realized what I have in common with environmentalists, but also why they’re so annoyingly wrong: They are conservationists of what is, whereas they should be conservationists of our potential over time, our cosmic endowment.(From a friend)",0.7999999999999999,-0.26666666666666666,Negative
@WholeMarsBlog There are so many crazy rules like this that make it extremely difficult to build anything new in California,2346,36180,2022-06-06 00:21:10,There are so many crazy rules like this that make it extremely difficult to build anything new in California,0.7136363636363636,-0.1159090909090909,Negative
"From Shakespeare’s The Tempest, but I much prefer it literally vs ironically",2559,47339,2022-06-06 00:15:25,"From Shakespeare’s The Tempest, but I much prefer it literally vs ironically",0.2,0.2,Positive
"O wonder!
How many goodly creatures are there here!
How beauteous mankind is! O brave new world,
That has such people in't.",6011,83737,2022-06-06 00:14:14,"O wonder!How many goodly creatures are there here!How beauteous mankind is! O brave new world,That has such people in't.",0.610909090909091,0.4622727272727272,Positive
@mlakan @EpochTimes Earth could sustain many times its current human population and the ecosystem would be fine. We definitely don’t have “too many people”.,8864,63729,2022-06-06 00:05:28,Earth could sustain many times its current human population and the ecosystem would be fine. We definitely don’t have “too many people”.,0.4166666666666667,0.23611111111111113,Positive
@nytimes This sounds promising,1087,32144,2022-06-05 19:15:40,This sounds promising,0.5,0.2,Positive
@Neuro_Skeptic We are a brain in a vat – the vat is our skull. All our senses and memories are electrical signals.,1676,23772,2022-06-05 19:08:44,We are a brain in a vat – the vat is our skull. All our senses and memories are electrical signals.,0.0,0.0,Neutral
"Some hate humanity, but I love humanity so much",31185,400396,2022-06-05 11:39:30,"Some hate humanity, but I love humanity so much",0.5666666666666667,-0.03333333333333335,Negative
"@baierm588 Build 1000+ Starships to transport life to Mars. Basically, (very) modern Noah’s Arks.",847,10451,2022-06-05 11:36:49,"Build 1000+ Starships to transport life to Mars. Basically, (very) modern Noah’s Arks.",0.39,0.26,Positive
@RenataKonkoly Maybe we should make an actual Starship model that dispenses pez for our merch store,470,11494,2022-06-05 11:33:38,Maybe we should make an actual Starship model that dispenses pez for our merch store,0.1,0.0,Neutral
"Making life multiplanetary expands the scope &amp; scale of consciousness. 

It also enables us to backup the biosphere, protecting all life as we know it from a calamity on Earth.

Humanity is life’s steward, as no other species can transport life to Mars. We can’t let them down.",12021,126571,2022-06-05 11:29:45,"Making life multiplanetary expands the scope &amp; scale of consciousness. It also enables us to backup the biosphere, protecting all life as we know it from a calamity on Earth.Humanity is life’s steward, as no other species can transport life to Mars. We can’t let them down.",0.3319444444444445,-0.04652777777777779,Negative
Deck from SpaceX all-hands update talk I gave last week https://t.co/ApsdPjjukh,6141,57647,2022-06-05 11:20:06,Deck from SpaceX all-hands update talk I gave last week,0.06666666666666667,0.0,Neutral
@GalaxyHeroesGHC It should be possible,1276,30624,2022-06-05 10:22:53,It should be possible,1.0,0.0,Neutral
@lexfridman That is why we must expand the scope &amp; scale of consciousness – so that we may learn the answers to these questions,4232,59872,2022-06-05 10:19:45,That is why we must expand the scope &amp; scale of consciousness – so that we may learn the answers to these questions,0.0,0.0,Neutral
@Tesmanian_com Accurate,834,18136,2022-06-05 03:12:47,Accurate,0.6333333333333334,0.4000000000000001,Positive
"@TimDOES @chazman @aelluswamy Not perfect, but should be better",114,2495,2022-06-05 01:16:07,"Not perfect, but should be better",0.75,0.0,Neutral
@chazman @aelluswamy 10.13 will solve your left turn most of the time,336,7352,2022-06-05 01:11:04,10.13 will solve your left turn most of the time,0.25,0.25,Positive
"@GasOff2 Yes, car will navigate to a pin location, even if in a complex surface parking lot or hotel entrance.

When in covered or underground parking lots, car will have to navigate using only inertial measurement, wheel movement &amp; vision, as GPS signal is no longer available.",275,4192,2022-06-04 21:52:03,"Yes, car will navigate to a pin location, even if in a complex surface parking lot or hotel entrance.When in covered or underground parking lots, car will have to navigate using only inertial measurement, wheel movement &amp; vision, as GPS signal is no longer available.",0.6,0.03333333333333335,Positive
"@slashdot Remarkable, although, as noted, there are big differences between humans and mice. We can cure a mouse of almost any cancer, but most of those cures don’t work with humans.",2146,29490,2022-06-04 20:21:11,"Remarkable, although, as noted, there are big differences between humans and mice. We can cure a mouse of almost any cancer, but most of those cures don’t work with humans.",0.45,0.4166666666666667,Positive
@v_g_fischer We are close to the point where offering something for EU regulators to review makes sense,261,4045,2022-06-04 20:16:29,We are close to the point where offering something for EU regulators to review makes sense,0.0,0.0,Neutral
"Also, FSD Beta 10.12.2 now expanding to 100k cars. 

10.13 smooths out intersection control, especially long lefts, and starts to handle roads with no map data at all. 

Last point is a big deal. Within a few months, FSD should be able to drive to a GPS point with zero map data.",2505,34438,2022-06-04 20:12:39,"Also, FSD Beta 10.12.2 now expanding to 100k cars. 10.13 smooths out intersection control, especially long lefts, and starts to handle roads with no map data at all. Last point is a big deal. Within a few months, FSD should be able to drive to a GPS point with zero map data.",0.3383333333333333,0.039999999999999994,Positive
"Working on Tesla North American service. 

Goal is 2/3 of cars receive same-day service, no wait.",4897,83340,2022-06-04 20:05:13,"Working on Tesla North American service. Goal is 2/3 of cars receive same-day service, no wait.",0.0,0.0,Neutral
@BillyM2k BTS music videos are 🔥🔥,8278,39888,2022-06-04 20:03:14,BTS music videos are ,0.0,0.0,Neutral
"@WholeMarsBlog Total headcount will increase, but salaried should be fairly flat",902,16659,2022-06-04 20:00:06,"Total headcount will increase, but salaried should be fairly flat",0.4375,-0.0125,Negative
"Sometimes I think my list of enemies is too short, so …",10164,170880,2022-06-04 19:47:10,"Sometimes I think my list of enemies is too short, so …",0.3,0.0,Neutral
@Kristennetten @alifarhat79 @VanityFair Interesting,423,10838,2022-06-04 19:20:17,Interesting,0.5,0.5,Positive
"@alifarhat79 Ah yes, Maxwell photobombing me at a @VanityFair Oscars party – you should them why they invited her. 

The same people who push this photo say nothing about prominent people who actually went to his island a dozen times. Also very strange …",7191,72540,2022-06-04 19:05:51,"Ah yes, Maxwell photobombing me at a  Oscars party – you should them why they invited her. The same people who push this photo say nothing about prominent people who actually went to his island a dozen times. Also very strange …",0.35500000000000004,0.10875,Positive
@pity_martine Are you saying that this is a far left taunt?,523,13101,2022-06-04 19:00:05,Are you saying that this is a far left taunt?,0.5,0.05,Positive
Only thing more remarkable than DOJ not leaking the list is that no one in the media cares. Doesn’t that seem odd? https://t.co/JEK4TErABB,73935,438526,2022-06-04 18:57:49,Only thing more remarkable than DOJ not leaking the list is that no one in the media cares. Doesn’t that seem odd?,0.625,0.2708333333333333,Positive
@NASASpaceflight Same,257,7426,2022-06-04 17:08:21,Same,0.125,0.0,Neutral
Four Falcon Heavy flights later this year by an incredible team at SpaceX https://t.co/WUQ72lKZPe,3830,43910,2022-06-04 17:03:50,Four Falcon Heavy flights later this year by an incredible team at SpaceX,0.4666666666666666,0.2333333333333333,Positive
@SawyerMerritt Sigh,2221,59056,2022-06-04 16:52:25,Sigh,0.0,0.0,Neutral
@waitbutwhy Wow,149,3563,2022-06-04 16:33:15,Wow,1.0,0.1,Positive
@CatherinScience @JohnnaCrider1 Yeah,70,1793,2022-06-04 15:56:15,Yeah,0.0,0.0,Neutral
@Andst7 Some of these options should be on by default and explicitly asked of users from time to time,133,2107,2022-06-04 15:44:15,Some of these options should be on by default and explicitly asked of users from time to time,0.0,0.0,Neutral
@Andst7 Interesting,850,19993,2022-06-04 15:36:57,Interesting,0.5,0.5,Positive
"@Rainmaker1973 Fallout 3, NV &amp; 4 were great",1242,23801,2022-06-04 15:23:15,"Fallout 3, NV &amp; 4 were great",0.75,0.8,Positive
"@JohnnaCrider1 They also usually have no sense of humor, apart from mocking the other side",200,2709,2022-06-04 15:17:33,"They also usually have no sense of humor, apart from mocking the other side",0.3125,-0.1875,Negative
"@WholeMarsBlog Often, when we announce something, we hear simultaneous criticism that it’s already been done, but also that it’s impossible 🤣🤣",1410,19983,2022-06-04 15:13:15,"Often, when we announce something, we hear simultaneous criticism that it’s already been done, but also that it’s impossible ",1.0,-0.6666666666666666,Negative
"@JohnnaCrider1 Both the far left &amp; far right have a lot of hate. 

One could simply replace the word “far” with “loathing”, as they have that emotion a lot, whereas most people, who are moderates, do not.",278,2932,2022-06-04 15:09:20,"Both the far left &amp; far right have a lot of hate. One could simply replace the word “far” with “loathing”, as they have that emotion a lot, whereas most people, who are moderates, do not.",0.6616071428571428,0.03571428571428571,Positive
@Insaan_07 True,115,3556,2022-06-04 07:09:53,True,0.65,0.35,Positive
"@teslaownersSV @long_elon My bro &amp; I had dinner at the El Camino Jack in the Box almost every night around late 95. Some people had died from food poisoning a few years earlier, so prices were low. @kimbal",328,5788,2022-06-04 05:55:21,"My bro &amp; I had dinner at the El Camino Jack in the Box almost every night around late 95. Some people had died from food poisoning a few years earlier, so prices were low.",0.375,-0.125,Negative
@slashdot Quality commenters on /.,436,9817,2022-06-04 04:34:07,Quality commenters on /.,0.0,0.0,Neutral
Getty watermark is the coup de grâce https://t.co/c4SHu4zXrU,5634,98735,2022-06-04 04:04:22,Getty watermark is the coup de grâce,0.0,0.0,Neutral
Diabolical! https://t.co/AJAJR8Nf3z,21910,248356,2022-06-04 03:52:11,Diabolical!,0.0,0.0,Neutral
"@slashdot The press always plays along with the class-action law firms, who are the real plaintiffs, not the puppets they find to masquerade as such. Why is this?",329,4961,2022-06-04 02:24:09,"The press always plays along with the class-action law firms, who are the real plaintiffs, not the puppets they find to masquerade as such. Why is this?",0.4,0.1,Positive
@karpathy Sigh,128,3210,2022-06-04 02:05:28,Sigh,0.0,0.0,Neutral
@RenataKonkoly Wow,64,1519,2022-06-04 01:54:48,Wow,1.0,0.1,Positive
Johnny Rotten of The Sex Pistols https://t.co/u8v8KFUn7N,35291,210203,2022-06-04 01:39:07,Johnny Rotten of The Sex Pistols,0.0,0.0,Neutral
@BillyM2k @adam_tooze @gladstein That is quite the trend,346,6501,2022-06-04 01:02:43,That is quite the trend,0.0,0.0,Neutral
@scoumbourdis Nice work by OpenAI. It is hard to do useful things.,560,12918,2022-06-04 00:58:11,Nice work by OpenAI. It is hard to do useful things.,0.5138888888888888,0.20277777777777775,Positive
@teslaownersSV @kgee @EliBurton_ @klwtts @JackBox Good interview,606,14143,2022-06-03 18:40:21,Good interview,0.6000000000000001,0.7,Positive
"@Forbes Thanks Mr President!
https://t.co/dCcTQLsJTp",6588,87167,2022-06-03 15:19:26,Thanks Mr President!,0.2,0.25,Positive
@PPathole @SpaceX That is its primary purpose,1341,31400,2022-06-03 14:37:00,That is its primary purpose,0.5,0.4,Positive
"@PPathole 70 is currently the age when you receive maximum social security benefits. In other words, that’s when the govt concludes that you can’t hold a job!!",742,8634,2022-06-03 14:19:16,"70 is currently the age when you receive maximum social security benefits. In other words, that’s when the govt concludes that you can’t hold a job!!",0.28055555555555556,-0.05399305555555556,Negative
@stats_feed !!,2097,52032,2022-06-03 14:16:59,!!,0.0,0.0,Neutral
"@PPathole Open primaries sound like a good way to move candidates to be more centrist.

Term limits help with the gerontocracy problem, but, frankly, there should be a max age beyond which you can’t run (maybe 70?), just like there are min ages for house, senate &amp; president.",1076,12669,2022-06-03 14:16:07,"Open primaries sound like a good way to move candidates to be more centrist.Term limits help with the gerontocracy problem, but, frankly, there should be a max age beyond which you can’t run (maybe 70?), just like there are min ages for house, senate &amp; president.",0.5,0.4,Positive
"@VW @Tesla Thanks, and also well done to you for advancing electric vehicles!",257,6185,2022-06-03 14:01:16,"Thanks, and also well done to you for advancing electric vehicles!",0.2,0.25,Positive
@heydave7 No,245,6313,2022-06-03 13:56:06,No,0.0,0.0,Neutral
"@ExplainThisBob Once again, Bob nails it.

Yes, I am endorsing a political candidate because he is competent!",158,4024,2022-06-03 13:29:15,"Once again, Bob nails it.Yes, I am endorsing a political candidate because he is competent!",0.3833333333333333,0.3125,Positive
"It is rare for me to endorse political candidates. 

My political leanings are moderate, so neither fully Republican nor Democrat, which I am confident is the case for most Americans.

Executive competence is super underrated in politics – we should care about that a lot more!",7675,98299,2022-06-03 13:25:13,"It is rare for me to endorse political candidates. My political leanings are moderate, so neither fully Republican nor Democrat, which I am confident is the case for most Americans.Executive competence is super underrated in politics – we should care about that a lot more!",0.5375,0.28229166666666666,Positive
Los Angeles is fortunate to have someone like Rick Caruso running for mayor. He’s awesome.,7538,109913,2022-06-03 13:08:57,Los Angeles is fortunate to have someone like Rick Caruso running for mayor. He’s awesome.,0.85,0.7,Positive
@EvaFoxU Tesla AI Day #2 will be epic,664,8895,2022-06-03 00:59:42,Tesla AI Day  will be epic,0.4,0.1,Positive
"Tesla AI Day pushed to Sept 30, as we may have an Optimus prototype working by then",8860,126828,2022-06-03 00:52:57,"Tesla AI Day pushed to Sept 30, as we may have an Optimus prototype working by then",0.0,0.0,Neutral
@WatchersTank @NASASpaceflight @SpaceX Cryogenic proof test passed,1105,26556,2022-06-02 23:53:15,Cryogenic proof test passed,0.0,0.0,Neutral
"@abledoc @scottfarkas @Tesla @JoeJustice Everyone eats same food, uses same restrooms, etc – no executive chef or other ivory tower stuff. 

There shouldn’t be this workers vs management two-class system. Everyone is a worker.",2011,19205,2022-06-02 16:45:43,"Everyone eats same food, uses same restrooms, etc – no executive chef or other ivory tower stuff. There shouldn’t be this workers vs management two-class system. Everyone is a worker.",0.20833333333333334,-0.041666666666666664,Negative
"@jamesdouma @RadarMoron @JeffTutorials @karpathy Transformers are replacing C heuristics for post-processing of the vision NN’s “giant bag of points”.

[Side note: I hate the bloated mess that is modern C++, but love simple C, as you know what it will compile to in terms of actual CPU operations.]",414,5984,2022-06-02 08:13:53,"Transformers are replacing C heuristics for post-processing of the vision NN’s “giant bag of points”.[Side note: I hate the bloated mess that is modern C++, but love simple C, as you know what it will compile to in terms of actual CPU operations.]",0.4903061224489796,-0.039285714285714306,Negative
@scottfarkas The above set of tweets illustrate why recessions serve a vital economic cleansing function,469,6529,2022-06-02 07:48:40,The above set of tweets illustrate why recessions serve a vital economic cleansing function,0.2333333333333333,0.10000000000000002,Positive
"@spideycyp_155 @eringriffith I never wanted to be CEO – just wanted to work on product/technology. Bill Harris sounded like he would be a great CEO, given his Intuit experience, but he was not.

Running companies hurts my heart, but I don’t see any other way to bring technology &amp; design to fruition.",763,9844,2022-06-02 07:37:09,"I never wanted to be CEO – just wanted to work on product/technology. Bill Harris sounded like he would be a great CEO, given his Intuit experience, but he was not.Running companies hurts my heart, but I don’t see any other way to bring technology &amp; design to fruition.",0.5625,0.3375,Positive
@OrbitHigher @JeffTutorials Yeah,79,2050,2022-06-02 05:57:05,Yeah,0.0,0.0,Neutral
@eringriffith Similar thing happened to X/PayPal in March 2000,70,1331,2022-06-02 05:47:57,Similar thing happened to X/PayPal in March 2000,0.4,0.0,Neutral
"@JeffTutorials We’re using more GPTs, as they now run natively on Tesla TRIP chip vs needing to round trip to iGPU",553,15057,2022-06-02 03:01:05,"We’re using more GPTs, as they now run natively on Tesla TRIP chip vs needing to round trip to iGPU",0.45,0.15,Positive
@justwidle2 @Tesla As I said in 2018 …,224,5520,2022-06-01 18:02:54,As I said in 2018 …,0.0,0.0,Neutral
"We are trying to accelerate sustainable energy, so what matters is how much someone can contribute to that goal. 

Personal choices are your own and are respected.",4187,67607,2022-06-01 16:05:22,"We are trying to accelerate sustainable energy, so what matters is how much someone can contribute to that goal. Personal choices are your own and are respected.",0.5,0.26666666666666666,Positive
"Tesla scores 100/100 for 7th year in a row for LGBTQ equality
 https://t.co/9wvCbgrtUE",4795,64195,2022-06-01 15:58:28,Tesla scores 100/100 for 7th year in a row for LGBTQ equality,0.0,0.0,Neutral
@spideycyp_155 @AndrewYang I will donate to centrist candidates in both parties,547,9819,2022-06-01 06:47:43,I will donate to centrist candidates in both parties,0.0,0.0,Neutral
"@AndrewYang Is this a reference to open primaries? I think those are a good idea. 

I am in favor of anything that would result in more centrist candidates being elected!",1103,24973,2022-06-01 06:41:38,Is this a reference to open primaries? I think those are a good idea. I am in favor of anything that would result in more centrist candidates being elected!,0.5333333333333333,0.44166666666666665,Positive
"@PPathole @Rainmaker1973 The amazing part will be having an orbital rocket that is fully &amp; rapidly reusable with any payload at all!

Everyone else gave up when they realized that their fully reusable payload&lt;0.

We still have a long way to go.",345,5120,2022-06-01 06:23:59,The amazing part will be having an orbital rocket that is fully &amp; rapidly reusable with any payload at all!Everyone else gave up when they realized that their fully reusable payload&lt;0.We still have a long way to go.,0.65,0.275,Positive
