Tweets,Retweets,Likes,Date,Cleaned_Tweets,Subjectivity,Polarity,Sentiment
@PeterSchiff 🤣 thanks,209,7021,2022-10-27 16:17:39, thanks,0.2,0.2,Positive
@ZubyMusic Absolutely,755,26737,2022-10-27 13:19:25,Absolutely,0.9,0.2,Positive
Dear Twitter Advertisers https://t.co/GMwHmInPAS,55927,356623,2022-10-27 13:08:00,Dear Twitter Advertisers,0.0,0.0,Neutral
Meeting a lot of cool people at Twitter today!,9366,195546,2022-10-26 21:39:32,Meeting a lot of cool people at Twitter today!,0.65,0.4375,Positive
Entering Twitter HQ – let that sink in! https://t.co/D68z4K2wq7,145520,1043592,2022-10-26 18:45:58,Entering Twitter HQ – let that sink in!,0.0,0.0,Neutral
@ARodTV Definitely closer to citizen journalism – local news orgs are under-appreciated &amp; should get way more prominence on Twitter,699,10189,2022-10-26 17:05:16,Definitely closer to citizen journalism – local news orgs are under-appreciated &amp; should get way more prominence on Twitter,0.3333333333333333,0.16666666666666666,Positive
@sandyleevincent Nobody bats 1000 🤷‍♂️,126,2920,2022-10-26 15:42:50,Nobody bats 1000 ,0.0,0.0,Neutral
A beautiful thing about Twitter is how it empowers citizen journalism – people are able to disseminate news without an establishment bias,37951,294406,2022-10-26 15:27:40,A beautiful thing about Twitter is how it empowers citizen journalism – people are able to disseminate news without an establishment bias,0.8125,0.675,Positive
@teslaownersSV I’m a big fan of citizen journalism!,488,5529,2022-10-26 15:22:43,I’m a big fan of citizen journalism!,0.1,0.0,Neutral
“According to unnamed sources close to the matter who wish to remain anonymous” 🤣🤣,4603,62693,2022-10-26 14:50:58,“According to unnamed sources close to the matter who wish to remain anonymous” ,0.0,0.0,Neutral
"“The New York Times has emerged as a new, chaotic actor in global politics. The paper’s interventions in some of the world’s most combustible conflicts have sometimes been a boon, but their messaging has also caused problems.”",10733,100922,2022-10-26 14:48:22,"“The New York Times has emerged as a new, chaotic actor in global politics. The paper’s interventions in some of the world’s most combustible conflicts have sometimes been a boon, but their messaging has also caused problems.”",0.3522727272727273,0.19318181818181818,Positive
@PPathole @Twitter Yes!,477,14209,2022-10-26 07:27:48,Yes!,0.0,0.0,Neutral
@westcoastbill 30% is a lot,149,2863,2022-10-26 06:32:58,30% is a lot,0.0,0.0,Neutral
@eldsjal Concerning,719,17443,2022-10-26 06:28:34,Concerning,0.0,0.0,Neutral
Works on any moving land object https://t.co/Xu4qKJW4D9,3565,41798,2022-10-25 23:26:39,Works on any moving land object,0.0,0.0,Neutral
@chazman @lexfridman Fasting rocks,284,4981,2022-10-25 13:54:37,Fasting rocks,0.0,0.0,Neutral
@VitalikButerin @balajis @zengjiajun_eth Had to do a double-take. This is the first non-fake Vitalik tweet I’ve seen in a while.,573,11512,2022-10-25 13:24:27,Had to do a double-take. This is the first non-fake Vitalik tweet I’ve seen in a while.,0.3333333333333333,0.25,Positive
@garyblack00 @SawyerMerritt One man’s hedge is another man’s shrub,241,4712,2022-10-25 08:30:54,One man’s hedge is another man’s shrub,0.0,0.0,Neutral
@muskQu0tes Yup,347,9328,2022-10-25 08:19:58,Yup,0.0,0.0,Neutral
@emollick True,238,4711,2022-10-25 08:11:11,True,0.65,0.35,Positive
@elon_wisdom Too much respect for authority inhibits innovation,4121,40332,2022-10-25 08:01:29,Too much respect for authority inhibits innovation,0.2,0.2,Positive
What lesson took you the longest to unlearn?,11678,148115,2022-10-25 04:33:08,What lesson took you the longest to unlearn?,0.0,0.0,Neutral
διαλεκτική,6978,97401,2022-10-25 01:25:34,διαλεκτική,0.0,0.0,Neutral
"@SwipeWright Twitter should be as broadly inclusive as possible, serving as a fair forum for lively, even if occasionally rancorous, debate between widely divergent beliefs.",3374,25719,2022-10-25 01:15:05,"Twitter should be as broadly inclusive as possible, serving as a fair forum for lively, even if occasionally rancorous, debate between widely divergent beliefs.",0.6854166666666667,-0.0001893939393939568,Negative
@MuskUniversity Absolutely necessary,138,2231,2022-10-24 22:45:37,Absolutely necessary,1.0,0.0,Neutral
@DavidSacks @MarcBodnick !,99,2261,2022-10-24 21:39:38,!,0.0,0.0,Neutral
@MuskUniversity Important,494,9551,2022-10-24 20:49:20,Important,1.0,0.4,Positive
@MuskUniversity Yup,75,1556,2022-10-24 20:46:26,Yup,0.0,0.0,Neutral
@DavidSacks Exactly!,116,2467,2022-10-24 20:41:15,Exactly!,0.25,0.3125,Positive
"@VinnyLingham Yeah, doesn’t make sense",1289,26093,2022-10-24 18:45:00,"Yeah, doesn’t make sense",0.0,0.0,Neutral
@MuskUniversity Good thread,133,2639,2022-10-24 13:49:02,Good thread,0.6000000000000001,0.7,Positive
@RenataKonkoly @spideycyp_155 @SquawkCNBC @Kasparov63 I only play crazy 9’s,91,1902,2022-10-24 13:42:48,I only play crazy 9’s,0.95,-0.3,Negative
"@MarcusHouse @LordofEa @kerrikgray @chicago_glenn @Tesla @teslaownersSV @dvorahfr @TonyadeVitti @SpaceX @SirineAti That’s the plan, unless it is damaged in testing. What really matters is that ship &amp; booster production line is spooling up. Also, each new ship &amp; booster has incremental design improvements.",235,3806,2022-10-24 13:39:48,"That’s the plan, unless it is damaged in testing. What really matters is that ship &amp; booster production line is spooling up. Also, each new ship &amp; booster has incremental design improvements.",0.32727272727272727,0.16818181818181818,Positive
"@ChananBos @SquawkCNBC @Kasparov63 Yeah, I’m back to spare bedroom /couch surfing at friend’s houses in Silicon Valley, which I did for about a decade.

Frankly, I like it this way, as I get to see my friends, who I love, more often.",281,5838,2022-10-24 13:35:53,"Yeah, I’m back to spare bedroom /couch surfing at friend’s houses in Silicon Valley, which I did for about a decade.Frankly, I like it this way, as I get to see my friends, who I love, more often.",0.3666666666666667,0.3333333333333333,Positive
"@spideycyp_155 @SquawkCNBC @Kasparov63 I did as a child, but found it to be too simple to be useful in real life: a mere 8 by 8 grid, no fog of war, no technology tree, no random map or spawn position, only 2 players, both sides exact same pieces, etc.

Polytopia addresses these limitations.",272,3692,2022-10-24 13:28:44,"I did as a child, but found it to be too simple to be useful in real life: a mere 8 by 8 grid, no fog of war, no technology tree, no random map or spawn position, only 2 players, both sides exact same pieces, etc.Polytopia addresses these limitations.",0.3790178571428572,0.0625,Positive
"@SquawkCNBC @Kasparov63 And I don’t even own a house, let alone a “mansion”, you douche",635,8781,2022-10-24 13:19:56,"And I don’t even own a house, let alone a “mansion”, you douche",1.0,0.6,Positive
"@SquawkCNBC @Kasparov63 While it’s true that Kasparov is almost as good at playing chess as my iPhone, he is otherwise an idiot",1882,15587,2022-10-24 13:13:07,"While it’s true that Kasparov is almost as good at playing chess as my iPhone, he is otherwise an idiot",0.6833333333333332,0.08333333333333326,Positive
@spideycyp_155 @Teslarati @Writer_01001101 @FedorovMykhailo Yes,75,1646,2022-10-24 12:58:14,Yes,0.0,0.0,Neutral
"@gunsnrosesgirl3 @DolphinDroneDom How exciting to be alive at the same time as the largest animal ever! 

Wild that Blue whales are bigger than the biggest dinosaur.",2112,47168,2022-10-24 12:48:28,How exciting to be alive at the same time as the largest animal ever! Wild that Blue whales are bigger than the biggest dinosaur.,0.3875,0.08333333333333333,Positive
@FedorovMykhailo @Teslarati @Writer_01001101 You’re most welcome,216,5152,2022-10-24 05:39:47,You’re most welcome,0.7,0.65,Positive
"@Teslarati @Writer_01001101 Before DoD even came back with an answer, I told @FedorovMykhailo that SpaceX would not turn off Starlink even if DoD refused to provide funding",1094,11673,2022-10-24 02:37:00,"Before DoD even came back with an answer, I told  that SpaceX would not turn off Starlink even if DoD refused to provide funding",0.0,0.0,Neutral
@LordofEa @kerrikgray @chicago_glenn @Tesla @teslaownersSV @dvorahfr @TonyadeVitti @SpaceX @SirineAti Absolutely!,513,10287,2022-10-23 22:36:41,Absolutely!,0.9,0.25,Positive
@SKMorefield Interesting,603,10825,2022-10-23 16:58:01,Interesting,0.5,0.5,Positive
@pcgamer Great game,1277,35925,2022-10-23 13:31:21,Great game,0.575,0.2,Positive
"Maybe it was a social media algorithm, not even people",3989,53403,2022-10-23 13:29:48,"Maybe it was a social media algorithm, not even people",0.06666666666666667,0.03333333333333333,Positive
Think about who might have decided “The Current Thing” before accepting it,12460,113306,2022-10-23 13:26:21,Think about who might have decided “The Current Thing” before accepting it,0.4,0.0,Neutral
"Who decides “The Current Thing?”
Real question. I don’t know.",9180,116769,2022-10-23 13:21:51,Who decides “The Current Thing?”Real question. I don’t know.,0.35000000000000003,0.1,Positive
@andst7 Exactly. WaPo are such hypocrites.,1392,17195,2022-10-23 13:10:44,Exactly. WaPo are such hypocrites.,0.375,0.125,Positive
Neuralink show &amp; tell now on Nov 30,4864,61933,2022-10-23 12:19:22,Neuralink show &amp; tell now on Nov 30,0.0,0.0,Neutral
@muskQu0tes @SpaceX Had to be done,532,11588,2022-10-23 12:11:12,Had to be done,0.0,0.0,Neutral
@Gfilche @MartinViecha We’ve come a long way,563,10958,2022-10-23 01:41:03,We’ve come a long way,0.4,-0.05,Negative
"i know
|nothing|
is forever",22736,211899,2022-10-23 00:29:28,i know|nothing|is forever,0.0,0.0,Neutral
@michaelmalice @washingtonpost Good point 🤔,1895,36854,2022-10-22 20:24:41,Good point ,0.6000000000000001,0.7,Positive
@MuskUniversity This needs to change. Manufacturing is awesome!,1325,19386,2022-10-22 19:54:11,This needs to change. Manufacturing is awesome!,1.0,1.0,Positive
@muskQu0tes It will happen,1106,23152,2022-10-22 17:24:03,It will happen,0.0,0.0,Neutral
@DavidSacks @TheAtlantic @davidfrum @EliotACohen Hear! Hear!,712,11610,2022-10-22 16:00:09,Hear! Hear!,0.0,0.0,Neutral
"@ruthbenghiat Why are you perpetuating propaganda concocted by the oil &amp; gas industry to distract you from the 6 trillion dollars per *year* of subsidies those companies receive?
https://t.co/XZxDJAPE9a",2163,24501,2022-10-22 15:06:32,Why are you perpetuating propaganda concocted by the oil &amp; gas industry to distract you from the 6 trillion dollars per *year* of subsidies those companies receive?,0.1,-0.1,Negative
"@stillgray @DavidSacks Switzerland &amp; Belgium have great chocolate, but I do also love eccentric British &amp; Irish artisanal sweet shops",107,2003,2022-10-22 07:00:32,"Switzerland &amp; Belgium have great chocolate, but I do also love eccentric British &amp; Irish artisanal sweet shops",0.4166666666666667,0.27499999999999997,Positive
@DavidSacks Good thread,265,3761,2022-10-22 00:39:36,Good thread,0.6000000000000001,0.7,Positive
"@teslaownersSV Next week. It’s actually a major release, so a lot more internal testing is needed before going to public beta.",556,8565,2022-10-21 22:43:38,"Next week. It’s actually a major release, so a lot more internal testing is needed before going to public beta.",0.21333333333333332,0.1125,Positive
@ksadjadpour Cool,867,13902,2022-10-21 22:33:47,Cool,0.65,0.35,Positive
"@DavidSacks 🤣🤣 

Although there could be more R&amp;D in candy tbh. Feels like there hasn’t been much improvement in decades.",1039,27075,2022-10-21 22:20:58, Although there could be more R&amp;D in candy tbh. Feels like there hasn’t been much improvement in decades.,0.35,0.35,Positive
"@WholeMarsBlog Headline is misleading. Starlink can obviously offer far more robust positioning than GPS, as it will have ~1000X more satellites over time. 

Not all will have line of sight to users, but still &gt;10X GPS &amp; far stronger signal.

Just not today’s problem.",762,9831,2022-10-21 18:25:12,"Headline is misleading. Starlink can obviously offer far more robust positioning than GPS, as it will have ~1000X more satellites over time. Not all will have line of sight to users, but still &gt;10X GPS &amp; far stronger signal.Just not today’s problem.",0.7,0.24000000000000005,Positive
@eigenrobot One of my favorite conspiracy theories is that the world is actually 80% men,133,2735,2022-10-21 17:01:53,One of my favorite conspiracy theories is that the world is actually 80% men,0.55,0.25,Positive
@ChessProblem un ass ailable logic!,128,2797,2022-10-21 13:22:33,un ass ailable logic!,0.0,0.0,Neutral
@teslaownersSV Yes,183,4890,2022-10-21 07:25:23,Yes,0.0,0.0,Neutral
"@LifeboatHQ You’re right. Eventually, we all run out of time. https://t.co/GyXk9uZLIW",119,2138,2022-10-21 06:39:47,"You’re right. Eventually, we all run out of time.",0.5357142857142857,0.2857142857142857,Positive
"Only Giga Berlin can make these colors, as paint shop was specially built to apply many fine layers of paint, giving it complexity not otherwise possible https://t.co/Htis0LfRzV",2900,42072,2022-10-21 06:34:33,"Only Giga Berlin can make these colors, as paint shop was specially built to apply many fine layers of paint, giving it complexity not otherwise possible",0.7142857142857142,0.2547619047619048,Positive
"@teslaownersSV @BillyM2k Varies a lot. Tesla &amp; SpaceX are in good positions, but many other companies are not. 

Recessions do have a silver lining in that companies that shouldn’t exist stop existing.",337,3623,2022-10-21 06:11:05,"Varies a lot. Tesla &amp; SpaceX are in good positions, but many other companies are not. Recessions do have a silver lining in that companies that shouldn’t exist stop existing.",0.4916666666666667,0.35833333333333334,Positive
"@RenataKonkoly @ThorstenBasch @spideycyp_155 @BillyM2k Those who want Putin removed are laboring under the misapprehension that whoever replaces him will be more amenable to peace or western philosophy, but I think this is unlikely – the Kremlin is not the Nice Guy Olympics",508,5406,2022-10-21 05:54:23,"Those who want Putin removed are laboring under the misapprehension that whoever replaces him will be more amenable to peace or western philosophy, but I think this is unlikely – the Kremlin is not the Nice Guy Olympics",0.52,0.15999999999999998,Positive
"@ThorstenBasch @spideycyp_155 @BillyM2k Russia overrunning Ukraine would destabilize the entire region, perhaps the world",102,1484,2022-10-21 05:45:12,"Russia overrunning Ukraine would destabilize the entire region, perhaps the world",0.625,0.0,Neutral
"@spideycyp_155 @BillyM2k If Russia faced calamitous defeat in conventional warfare for something as strategically critical as Crimea, the probability of using nuclear weapons is high",123,1465,2022-10-21 05:12:37,"If Russia faced calamitous defeat in conventional warfare for something as strategically critical as Crimea, the probability of using nuclear weapons is high",0.5657142857142857,0.005714285714285718,Positive
@jamesplloyd @SpaceX I do. Yes.,78,2029,2022-10-21 05:09:52,I do. Yes.,0.0,0.0,Neutral
"@spideycyp_155 @BillyM2k Still very unlikely, but this is the closest we’ve been since Cuba in ‘62",102,1582,2022-10-21 05:06:29,"Still very unlikely, but this is the closest we’ve been since Cuba in ‘62",0.65,-0.65,Negative
"@teslaownersSV @BillyM2k Just guessing, but probably until spring of ‘24",561,5054,2022-10-21 04:53:50,"Just guessing, but probably until spring of ‘24",0.0,0.0,Neutral
@BillyM2k It sure would be nice to have one year without a horrible global event,3155,50073,2022-10-21 04:51:37,It sure would be nice to have one year without a horrible global event,0.7222222222222222,0.025000000000000022,Positive
@AndrewPerpetua “Brutal for both sides” will be a common phrase in the months to come,91,1555,2022-10-21 04:42:02,“Brutal for both sides” will be a common phrase in the months to come,0.75,-0.5875,Negative
@bgarlinghouse No way,2842,20196,2022-10-21 02:57:24,No way,0.0,0.0,Neutral
@SamitoFPS Maybe,153,3127,2022-10-21 02:00:08,Maybe,0.0,0.0,Neutral
@NewsfromScience Certainly warrants closer scrutiny,1303,16245,2022-10-21 01:50:54,Certainly warrants closer scrutiny,0.5714285714285714,0.21428571428571427,Positive
"@MedvedevRussiaE @trussliz Btw, how’s it going in Bakhmut?",751,15340,2022-10-20 21:20:40,"Btw, how’s it going in Bakhmut?",0.0,0.0,Neutral
@MedvedevRussiaE @trussliz Pretty good troll tbh,1347,39191,2022-10-20 21:12:17,Pretty good troll tbh,0.8,0.475,Positive
@Alan_McGuinness *humour,125,4777,2022-10-20 21:07:30,*humour,0.0,0.0,Neutral
@ilyasut I couldn’t agree more 😜,100,2418,2022-10-20 20:37:33,I couldn’t agree more ,0.5,0.5,Positive
@Alan_McGuinness British humor is the best,1981,58475,2022-10-20 20:36:51,British humor is the best,0.15,0.5,Positive
@PPathole @EvaFoxU @DavidSacks Compromise is overwhelmingly the most likely outcome – just a question of how much death &amp; destruction happens before then,383,4643,2022-10-20 17:42:06,Compromise is overwhelmingly the most likely outcome – just a question of how much death &amp; destruction happens before then,0.675,0.3,Positive
@gaborgurbacs @EvaFoxU @DavidSacks That should be the nature of the debate,71,1395,2022-10-20 17:39:15,That should be the nature of the debate,0.0,0.0,Neutral
"@EvaFoxU @DavidSacks Most probable outcome by far is a horrible war of attrition that destroys Ukraine &amp; severely damages Russia, with massive body count on both sides.

And, in the end, the same outcome. 

So why?",265,3209,2022-10-20 17:32:08,"Most probable outcome by far is a horrible war of attrition that destroys Ukraine &amp; severely damages Russia, with massive body count on both sides.And, in the end, the same outcome. So why?",0.725,-0.08,Negative
@DavidSacks Exactly,1104,26370,2022-10-20 16:43:40,Exactly,0.25,0.25,Positive
Congrats to @SpaceX team on 48th launch this year! Falcon 9 now holds record for most launches of a single vehicle type in a year.,5308,75918,2022-10-20 16:31:46,Congrats to  team on 48th launch this year! Falcon 9 now holds record for most launches of a single vehicle type in a year.,0.35714285714285715,0.2142857142857143,Positive
@Neuro_Skeptic Same,287,6627,2022-10-20 09:26:29,Same,0.125,0.0,Neutral
@marenkahnert @jasondebolt Exactly,79,1963,2022-10-20 07:57:25,Exactly,0.25,0.25,Positive
"@Teslarati @13ericralph31 SpaceX has more active satellites in orbit than rest of Earth combined, tracking to double rest of Earth soon",1465,16597,2022-10-20 07:30:52,"SpaceX has more active satellites in orbit than rest of Earth combined, tracking to double rest of Earth soon",0.3666666666666667,0.12222222222222223,Positive
"@jasondebolt The media reports with great fanfare my predictions that are late, but rarely those that come early",1569,23663,2022-10-20 06:52:01,"The media reports with great fanfare my predictions that are late, but rarely those that come early",0.6375,0.225,Positive
@Teslarati @JohnnaCrider1 Accelerating sustainable energy is our primary mission,1458,18526,2022-10-20 00:10:14,Accelerating sustainable energy is our primary mission,0.5,0.4,Positive
"@westcoastbill Will require truly exceptional execution, but it is possible",745,11060,2022-10-19 22:33:20,"Will require truly exceptional execution, but it is possible",1.0,0.3333333333333333,Positive
"I will not let you down, no matter what it takes",35111,392237,2022-10-19 18:46:58,"I will not let you down, no matter what it takes",0.2888888888888889,-0.15555555555555559,Negative
@DirtyTesLa Awesome,88,2381,2022-10-19 18:13:39,Awesome,1.0,1.0,Positive
"We even did a Starlink video call on one airplane aloft to Starlink on another, far away, airplane aloft and it worked perfectly with no lag!",2060,37029,2022-10-19 17:02:48,"We even did a Starlink video call on one airplane aloft to Starlink on another, far away, airplane aloft and it worked perfectly with no lag!",1.0,0.55,Positive
Vox Populi Vox Dei,5709,53880,2022-10-19 16:59:23,Vox Populi Vox Dei,0.0,0.0,Neutral
"@chazman @aelluswamy Several major architectural upgrades in 10.69.3, so it’s much more than a point release, but we’re sticking with 10.69 just cause haha",470,7090,2022-10-19 13:45:30,"Several major architectural upgrades in 10.69.3, so it’s much more than a point release, but we’re sticking with 10.69 just cause haha",0.325,0.190625,Positive
@BillyM2k @atrupar Sounds fair,215,5357,2022-10-19 04:38:38,Sounds fair,0.9,0.7,Positive
@BillyM2k Definitely giving me kid naming ideas 🤣,1364,43868,2022-10-19 03:59:49,Definitely giving me kid naming ideas ,0.5,0.0,Neutral
And … sold out!,1745,57905,2022-10-19 03:58:56,And … sold out!,0.0,0.0,Neutral
Internet in airplanes will feel same as if you were accessing Internet at home! https://t.co/Mfl2ixYnJH,8082,98109,2022-10-19 03:37:07,Internet in airplanes will feel same as if you were accessing Internet at home!,0.125,0.0,Neutral
"28,700 bottles of exquisite Burnt Hair perfume already sold! 

Only 1,300 left of this unique, limited edition, collector’s item. https://t.co/Gh2Zg7B5qX",3324,46000,2022-10-19 01:42:18,"28,700 bottles of exquisite Burnt Hair perfume already sold! Only 1,300 left of this unique, limited edition, collector’s item.",0.6285714285714286,0.26071428571428573,Positive
@cb_doge @alex_avoigt We’re working on it. Hope to release something next week.,183,2900,2022-10-19 00:07:43,We’re working on it. Hope to release something next week.,0.0,0.0,Neutral
"@alex_avoigt No money from DoD, but several other countries, orgs &amp; individuals are paying for ~11k/25k terminals (thanks!).

SpaceX is losing ~$20M/month due to unpaid service &amp; costs related to enhanced security measures for cyberwar defense, but we’ll keep doing it (sigh).",2801,33352,2022-10-19 00:06:14,"No money from DoD, but several other countries, orgs &amp; individuals are paying for ~11k/25k terminals (thanks!).SpaceX is losing ~$20M/month due to unpaid service &amp; costs related to enhanced security measures for cyberwar defense, but we’ll keep doing it (sigh).",0.30999999999999994,-0.009999999999999998,Negative
"@atrupar Smart? Maybe. 
Does dumb stuff? Definitely!",589,12432,2022-10-18 20:27:31,Smart? Maybe. Does dumb stuff? Definitely!,0.5476190476190476,-0.053571428571428575,Negative
@balajis True,102,2671,2022-10-18 19:11:02,True,0.65,0.35,Positive
@520AlRihla Exactly,64,1531,2022-10-18 15:12:00,Exactly,0.25,0.25,Positive
"@larryronaldpar1 Should I make weapons? Ideally, not.",205,3868,2022-10-18 15:07:11,"Should I make weapons? Ideally, not.",1.0,-0.45,Negative
@TeslaHype An easy prediction,160,4861,2022-10-18 15:03:28,An easy prediction,0.8333333333333334,0.43333333333333335,Positive
"Drone War I
https://t.co/erVME0CbbN",5267,55658,2022-10-18 14:35:49,Drone War I,0.0,0.0,Neutral
@teslaownersSV (Actually) Smart Summon is almost done,785,15877,2022-10-18 06:11:12,(Actually) Smart Summon is almost done,0.6428571428571429,0.21428571428571427,Positive
@Teslaconomics Yes,571,12232,2022-10-18 02:19:08,Yes,0.0,0.0,Neutral
@stoolpresidente I have a plan,2331,64821,2022-10-18 01:52:35,I have a plan,0.0,0.0,Neutral
@TeslaAIBot @SpaceX @Tesla Thanks Optimus :),708,18697,2022-10-18 00:27:18,Thanks Optimus :),0.6,0.35,Positive
"@SawyerMerritt @SpaceX To be precise, 25,300 terminals were sent to Ukraine, but, at present, only 10,630 are paying for service",743,9328,2022-10-17 19:57:10,"To be precise, 25,300 terminals were sent to Ukraine, but, at present, only 10,630 are paying for service",0.6,0.13333333333333333,Positive
@SawyerMerritt @SpaceX SpaceX has already withdrawn its request for funding,3214,57357,2022-10-17 19:52:57,SpaceX has already withdrawn its request for funding,0.0,0.0,Neutral
"@starrski71 @RenataKonkoly @EvaFoxU @kadubai11 @spideycyp_155 Wrong analogy. America also had a humiliating withdrawal from Afghanistan. No one in America sees that country as part of America.

Crimea *is* seen as a crucial part of Russia by Russia, much as Hawaii is seen as a crucial part of America.",895,8736,2022-10-17 14:03:13,"Wrong analogy. America also had a humiliating withdrawal from Afghanistan. No one in America sees that country as part of America.Crimea *is* seen as a crucial part of Russia by Russia, much as Hawaii is seen as a crucial part of America.",0.775,-0.075,Negative
@PPathole @spideycyp_155 Probably not,91,2294,2022-10-17 13:48:51,Probably not,0.0,0.0,Neutral
@zerohedge Practice makes perfect …,2727,45837,2022-10-17 13:47:55,Practice makes perfect …,1.0,1.0,Positive
"@RenataKonkoly @EvaFoxU @kadubai11 @spideycyp_155 Russia has been punched in the nose and forced to retreat many times by Ukraine. 

But what you don’t want to do is give Russia a choice of total, humiliating defeat or nukes – then the probability of them using nukes is high.",243,3448,2022-10-17 13:46:13,"Russia has been punched in the nose and forced to retreat many times by Ukraine. But what you don’t want to do is give Russia a choice of total, humiliating defeat or nukes – then the probability of them using nukes is high.",0.49749999999999994,0.09,Positive
"@kadubai11 @spideycyp_155 Obviously many disagree with this logic, but what do they think is their probability of being wrong about WW3. 

If they say 0%, they are utterly dangerous fools.",380,4944,2022-10-17 13:41:33,"Obviously many disagree with this logic, but what do they think is their probability of being wrong about WW3. If they say 0%, they are utterly dangerous fools.",0.7666666666666666,-0.19999999999999998,Negative
