Tweets,Retweets,Likes,Date,Cleaned_Tweets,Subjectivity,Polarity,Sentiment
"@TechEmails The Instagram curse: 

Water everywhere, yet always thirsty.",1534,21559,2022-04-25 13:41:47,"The Instagram curse: Water everywhere, yet always thirsty.",0.0,0.0,Neutral
@PPathole @Tesla @SpaceX @neuralink @boringcompany I do love humanity,10276,209920,2022-04-25 13:33:50,I do love humanity,0.6,0.5,Positive
"@PPathole @WholeMarsBlog The San Francisco office of the SEC were shameless puppets of Wall St shortseller sharks, while doing nothing to protect actual shareholders. That is why I lost all respect for them.",6147,34548,2022-04-25 12:35:00,"The San Francisco office of the SEC were shameless puppets of Wall St shortseller sharks, while doing nothing to protect actual shareholders. That is why I lost all respect for them.",0.35,-0.05,Negative
"@WholeMarsBlog The head of Saudi PIF committed unequivocally to take Tesla private with me, as witnessed by the Tesla CFO and several others. That is why I said funding was secured.",1675,24172,2022-04-25 12:22:23,"The head of Saudi PIF committed unequivocally to take Tesla private with me, as witnessed by the Tesla CFO and several others. That is why I said funding was secured.",0.1875,0.0,Neutral
@Teslaconomics Yup,480,11286,2022-04-25 04:07:59,Yup,0.0,0.0,Neutral
"@JohnnaCrider1 @stats_feed Underground tunnels are immune to surface weather conditions (subways are a good example), so it wouldn’t matter to Hyperloop if a hurricane was raging on the surface. You wouldn’t even notice.",1030,14152,2022-04-24 22:43:15,"Underground tunnels are immune to surface weather conditions (subways are a good example), so it wouldn’t matter to Hyperloop if a hurricane was raging on the surface. You wouldn’t even notice.",0.6000000000000001,0.7,Positive
"@JohnnaCrider1 @stats_feed In the coming years, Boring Co will attempt to build a working Hyperloop. 

From a known physics standpoint, this is the fastest possible way of getting from one city center to another for distances less than ~2000 miles. Starship is faster for longer journeys.",1196,12123,2022-04-24 22:37:53,"In the coming years, Boring Co will attempt to build a working Hyperloop. From a known physics standpoint, this is the fastest possible way of getting from one city center to another for distances less than ~2000 miles. Starship is faster for longer journeys.",0.5416666666666667,-0.3166666666666667,Negative
"@WholeMarsBlog Next beta release has many improvements, especially for complex left turns &amp; heavy traffic",682,13548,2022-04-24 20:51:22,"Next beta release has many improvements, especially for complex left turns &amp; heavy traffic",0.39999999999999997,0.0,Neutral
@SawyerMerritt Strange how these things are bucketed. I think of the whole company as being R&amp;D.,1411,31241,2022-04-24 20:50:01,Strange how these things are bucketed. I think of the whole company as being R&amp;D.,0.275,0.07500000000000001,Positive
"@BillyM2k First one definitely, second is nice to have and third isn’t needed imo",1531,17359,2022-04-24 16:27:34,"First one definitely, second is nice to have and third isn’t needed imo",0.3333333333333333,0.2125,Positive
@stats_feed Tunnels anyone?,3463,102021,2022-04-24 16:20:53,Tunnels anyone?,0.0,0.0,Neutral
@TeslaJedi @Teslarati @ResidentSponge Drug naming conventions are so ridiculous! Does someone just literally have a random syllable generator!?,248,4841,2022-04-24 14:49:25,Drug naming conventions are so ridiculous! Does someone just literally have a random syllable generator!?,0.75,-0.5208333333333333,Negative
(from making fun of Gates for shorting Tesla while claiming to support climate change action),20724,390469,2022-04-24 14:25:01,(from making fun of Gates for shorting Tesla while claiming to support climate change action),0.15000000000000002,0.2,Positive
@PPathole @JamesWLaw1 @Teslarati @ResidentSponge Getting there,197,4245,2022-04-24 14:18:28,Getting there,0.0,0.0,Neutral
"@JamesWLaw1 @Teslarati @ResidentSponge Definitely. Might be less than 5 years away, as current version Neuralinks are semi-generalized neural read/write devices with ~1000 electrodes and tinnitus  probably needs &lt;&lt;1000.

Future gen Neuralinks will increase electrode count by many orders of magnitude.",198,2433,2022-04-24 13:52:43,"Definitely. Might be less than 5 years away, as current version Neuralinks are semi-generalized neural read/write devices with ~1000 electrodes and tinnitus  probably needs &lt;&lt;1000.Future gen Neuralinks will increase electrode count by many orders of magnitude.",0.3666666666666667,0.08333333333333334,Positive
"@Teslarati @ResidentSponge In the meantime, semaglutide (aka Ozempic/Rybelsus) appears to be effective in appetite control with minor side effects",477,6943,2022-04-24 13:35:55,"In the meantime, semaglutide (aka Ozempic/Rybelsus) appears to be effective in appetite control with minor side effects",0.5,0.27499999999999997,Positive
@TeslaOwnersEBay @Teslarati @ResidentSponge @neuralink Yes,246,4728,2022-04-24 13:30:46,Yes,0.0,0.0,Neutral
"@24_7TeslaNews @Teslarati @ResidentSponge Current generation Neuralinks can help to some degree, but an advanced case of Alzheimers often involves macro degeneration of the brain. 

However, Neuralinks should theoretically be able restore almost any functionality lost due *localized* brain damage from stroke or injury.",280,3566,2022-04-24 13:28:20,"Current generation Neuralinks can help to some degree, but an advanced case of Alzheimers often involves macro degeneration of the brain. However, Neuralinks should theoretically be able restore almost any functionality lost due *localized* brain damage from stroke or injury.",0.5,0.19375,Positive
@karpathy !,323,7986,2022-04-24 13:20:23,!,0.0,0.0,Neutral
"@Teslarati @ResidentSponge If you’ve engineered or manufactured smart watches or phones, please join Neuralink! Your skills are directly applicable.",3344,34765,2022-04-24 13:19:59,"If you’ve engineered or manufactured smart watches or phones, please join Neuralink! Your skills are directly applicable.",0.5214285714285715,0.18392857142857144,Positive
"@Teslarati @ResidentSponge It is an electronics/mechanical/software engineering problem for the Neuralink device that is similar in complexity level to smart watches (which are not easy!), plus the surgical robot, which is comparable to state-of-the art CNC machines.

No need for AI/ NN/ML quite yet.",509,6987,2022-04-24 13:17:30,"It is an electronics/mechanical/software engineering problem for the Neuralink device that is similar in complexity level to smart watches (which are not easy!), plus the surgical robot, which is comparable to state-of-the art CNC machines.No need for AI/ NN/ML quite yet.",0.6253968253968254,-0.018849206349206366,Negative
"@Teslarati @ResidentSponge Certainly physically possible. 

We’re working on bridging broken links between brain &amp; body.

Neuralinks in motor &amp; sensory cortex bridging past weak/broken links in neck/spine to Neuralinks in spinal cord should theoretically be able to restore full body functionality.",1304,14314,2022-04-24 13:08:16,Certainly physically possible. We’re working on bridging broken links between brain &amp; body.Neuralinks in motor &amp; sensory cortex bridging past weak/broken links in neck/spine to Neuralinks in spinal cord should theoretically be able to restore full body functionality.,0.5650000000000001,0.039999999999999994,Positive
Moving on …,30999,486478,2022-04-24 11:46:48,Moving on …,0.0,0.0,Neutral
"@BillyM2k Also, epic printer scene in Office Space",587,12810,2022-04-24 01:58:53,"Also, epic printer scene in Office Space",0.4,0.1,Positive
@jack Your new title at Block is 🔥🔥,1953,45488,2022-04-23 21:10:51,Your new title at Block is ,0.45454545454545453,0.13636363636363635,Positive
@PPathole Yeah,1846,49344,2022-04-23 18:40:55,Yeah,0.0,0.0,Neutral
@wintonARK ESG ratings make no sense,3234,40657,2022-04-23 18:34:52,ESG ratings make no sense,0.0,0.0,Neutral
"@nichegamer Elden Ring is incredible, but why are extremely gory death/murder scenes ok, but panties get you banned!?",1151,21215,2022-04-23 06:26:51,"Elden Ring is incredible, but why are extremely gory death/murder scenes ok, but panties get you banned!?",0.7999999999999999,0.3416666666666666,Positive
@BillyM2k 🤣 also why are there still printers?,1883,53692,2022-04-23 06:10:07, also why are there still printers?,0.0,0.0,Neutral
@Teslarati Tesla China is doing incredible work,905,20373,2022-04-23 04:23:53,Tesla China is doing incredible work,0.9,0.9,Positive
shadow ban council reviewing tweet … https://t.co/cawjtwc7CW,41320,621127,2022-04-23 04:07:18,shadow ban council reviewing tweet …,0.0,0.0,Neutral
in case u need to lose a boner fast https://t.co/fcHiaXKCJi,134490,1401730,2022-04-23 03:30:45,in case u need to lose a boner fast,0.6,0.2,Positive
"@WholeMarsBlog Yeah, but I didn’t leak it to NYT. They must have got it through friends of friends. 

I heard from multiple people at TED that Gates still had half billion short against Tesla, which is why I asked him, so it’s not exactly top secret.",7069,56381,2022-04-23 03:12:44,"Yeah, but I didn’t leak it to NYT. They must have got it through friends of friends. I heard from multiple people at TED that Gates still had half billion short against Tesla, which is why I asked him, so it’s not exactly top secret.",0.3333333333333333,-0.16333333333333333,Negative
"@WholeMarsBlog FSD is best in Bay Area, given engineering mostly lives there, but rest of country will soon be at that level",442,8989,2022-04-23 02:49:16,"FSD is best in Bay Area, given engineering mostly lives there, but rest of country will soon be at that level",0.4,0.75,Positive
@PPathole @teslaownersSV @BillyM2k @engineers_feed Something like that,177,3837,2022-04-23 02:43:21,Something like that,0.0,0.0,Neutral
@AlexAndBooks_ Good list,912,22621,2022-04-23 02:35:48,Good list,0.6000000000000001,0.7,Positive
@teslaownersSV @BillyM2k @engineers_feed Yes,171,3533,2022-04-23 02:29:12,Yes,0.0,0.0,Neutral
@BillyM2k @engineers_feed So many “verified” scam crypto bots!,1046,14258,2022-04-23 01:46:47,So many “verified” scam crypto bots!,0.5,0.625,Positive
"@engineers_feed I will verify you. 

The current process for verification is like if Kafka had a Magic 8-Ball!",3932,77990,2022-04-22 23:55:33,I will verify you. The current process for verification is like if Kafka had a Magic 8-Ball!,0.7,0.3125,Positive
@PPathole I wish we did. Would be better for making life multiplanetary.,839,20362,2022-04-22 23:44:43,I wish we did. Would be better for making life multiplanetary.,0.5,0.5,Positive
What is best in life?,8831,163046,2022-04-22 23:43:11,What is best in life?,0.3,1.0,Positive
The Barbarians are at the Gate,25072,323800,2022-04-22 23:39:48,The Barbarians are at the Gate,0.0,0.0,Neutral
@teslaownersSV @SpaceX The real tragedy is that tie I’m wearing!,1656,66960,2022-04-22 23:37:13,The real tragedy is that tie I’m wearing!,0.30000000000000004,0.25,Positive
@WholeMarsBlog That number should probably be on my gravestone at this point,973,26536,2022-04-22 23:33:10,That number should probably be on my gravestone at this point,0.0,0.0,Neutral
@PPathole Yes,3367,79032,2022-04-22 08:25:58,Yes,0.0,0.0,Neutral
Believe in the future,25621,320122,2022-04-21 20:20:38,Believe in the future,0.125,0.0,Neutral
@APompliano Tesla is really a dozen or more startups if you look at all the things created from scratch that aren’t present in other car companies,2745,52748,2022-04-21 19:12:23,Tesla is really a dozen or more startups if you look at all the things created from scratch that aren’t present in other car companies,0.26875,0.14375,Positive
@SpaceX Starlink satellites deployed into initial parking orbit https://t.co/73sOZkUJaJ,1978,32413,2022-04-21 19:08:31,Starlink satellites deployed into initial parking orbit,0.0,0.0,Neutral
And authenticate all real humans,25009,448616,2022-04-21 18:56:34,And authenticate all real humans,0.30000000000000004,0.2,Positive
@johnkrausphotos Indeed (heavy sigh),362,12753,2022-04-21 18:55:59,Indeed (heavy sigh),0.5,-0.2,Negative
"If our twitter bid succeeds, we will defeat the spam bots or die trying!",73468,868464,2022-04-21 18:53:55,"If our twitter bid succeeds, we will defeat the spam bots or die trying!",0.1,0.875,Positive
"Such a joy to work with amazingly talented people at SpaceX, Tesla, Neuralink &amp; Boring Co!",13517,283847,2022-04-21 18:50:52,"Such a joy to work with amazingly talented people at SpaceX, Tesla, Neuralink &amp; Boring Co!",0.65,0.125,Positive
@WholeMarsBlog @Herbert_Diess Diess deserves a lot of credit for moving VW rapidly towards electrification. They’re lucky to have him.,953,26548,2022-04-21 18:46:24,Diess deserves a lot of credit for moving VW rapidly towards electrification. They’re lucky to have him.,0.8333333333333334,0.3333333333333333,Positive
"@SamTwits My true moral error was creating Tesla &amp; SpaceX at same time, while avoiding general mgmt chores at Tesla (focusing only on product &amp; engineering). Tried to have my cake &amp; eat it too, which failed.",341,5569,2022-04-21 18:43:45,"My true moral error was creating Tesla &amp; SpaceX at same time, while avoiding general mgmt chores at Tesla (focusing only on product &amp; engineering). Tried to have my cake &amp; eat it too, which failed.",0.47083333333333327,-0.016666666666666663,Negative
"@SamTwits Agreed. I wish JB &amp; I had just moved forward to commercialize the Tzero without adding other partners. In the end, that’s what happened anyway.",344,7479,2022-04-21 18:37:17,"Agreed. I wish JB &amp; I had just moved forward to commercialize the Tzero without adding other partners. In the end, that’s what happened anyway.",0.375,-0.125,Negative
@fermatslibrary Resistance is futile,1681,29825,2022-04-21 18:26:49,Resistance is futile,0.0,0.0,Neutral
@WholeMarsBlog The esthetics of the new rendering will improve,240,5239,2022-04-21 18:21:08,The esthetics of the new rendering will improve,0.45454545454545453,0.13636363636363635,Positive
"@TPostMillennial SNL is so rarely funny these day (sigh)
https://t.co/zYnkLgdDY8",1216,14391,2022-04-21 18:19:15,SNL is so rarely funny these day (sigh),1.0,0.25,Positive
@Erdayastronaut Making rocket reuse normal is the goal,900,20464,2022-04-21 18:16:09,Making rocket reuse normal is the goal,0.6499999999999999,0.15,Positive
@BillyM2k Always look on the bright side of life,5675,64673,2022-04-21 16:24:50,Always look on the bright side of life,0.7999999999999999,0.7000000000000001,Positive
@teslaownersSV @DimaZeniuk @billhuang688 @woonomic @VaibhavSisinty Maybe JB would be up for that too. He deserves a lot of credit (as do many longtime Tesla people).,290,5555,2022-04-21 09:33:36,Maybe JB would be up for that too. He deserves a lot of credit (as do many longtime Tesla people).,0.5,0.5,Positive
@teslaownersSV @DimaZeniuk @billhuang688 @woonomic @VaibhavSisinty Ok sure,221,5239,2022-04-21 09:32:39,Ok sure,0.6944444444444444,0.5,Positive
@Tesla__Mania @woonomic @VaibhavSisinty Yes,68,1842,2022-04-21 09:29:59,Yes,0.0,0.0,Neutral
"@garyblack00 The failures are mine, the successes belong to others",4074,55684,2022-04-21 09:28:24,"The failures are mine, the successes belong to others",0.0,0.0,Neutral
"@DimaZeniuk @billhuang688 @woonomic @VaibhavSisinty I should, but that would take a lot of time away from Tesla, SpaceX &amp; other work. Walter Isaacson is writing a book.",215,4004,2022-04-21 08:49:51,"I should, but that would take a lot of time away from Tesla, SpaceX &amp; other work. Walter Isaacson is writing a book.",0.375,-0.125,Negative
@PPathole @teslaownersSV @woonomic @VaibhavSisinty Exactly,137,3587,2022-04-21 08:42:11,Exactly,0.25,0.25,Positive
"@billhuang688 @woonomic @VaibhavSisinty I put in all I had, whereas Eberhard, who was worth over $10M at the time, refused to invest a penny to help Tesla. 

If it was really his baby, he would never have stood by while it starved to death.

https://t.co/ZDfYLD5qkL",355,4152,2022-04-21 08:40:07,"I put in all I had, whereas Eberhard, who was worth over $10M at the time, refused to invest a penny to help Tesla. If it was really his baby, he would never have stood by while it starved to death.",0.15000000000000002,0.25,Positive
"@teslaownersSV @woonomic @VaibhavSisinty But if he was actually capable of creating a company like Tesla, he would have done so after he was fired for lying outrageously about cost &amp; progress of Roadster in mid 2007.

We would’ve lost at least a few talented people if he was the real deal, but we lost no one.",395,5547,2022-04-21 08:33:10,"But if he was actually capable of creating a company like Tesla, he would have done so after he was fired for lying outrageously about cost &amp; progress of Roadster in mid 2007.We would’ve lost at least a few talented people if he was the real deal, but we lost no one.",0.4428571428571428,-0.057142857142857155,Negative
@teslaownersSV @woonomic @VaibhavSisinty Eberhard has been relentlessly pushing a false narrative about Tesla for 15 years. He’s a compelling liar. Fooled me for almost 3 years.,452,6083,2022-04-21 08:27:57,Eberhard has been relentlessly pushing a false narrative about Tesla for 15 years. He’s a compelling liar. Fooled me for almost 3 years.,0.6,-0.050000000000000044,Negative
"@woonomic @VaibhavSisinty They say history is written by the victors, but not on Wikipedia if the losing party is still alive &amp; has lots of time on their hands!",1071,10676,2022-04-21 08:21:40,"They say history is written by the victors, but not on Wikipedia if the losing party is still alive &amp; has lots of time on their hands!",0.4,0.125,Positive
"@woonomic @VaibhavSisinty When Eberhard was fired unanimously by the board in July 2007 (for damn good reasons), no one left with him. That says it all.",425,8706,2022-04-21 08:15:37,"When Eberhard was fired unanimously by the board in July 2007 (for damn good reasons), no one left with him. That says it all.",0.30000000000000004,0.35,Positive
"@woonomic @VaibhavSisinty If filing a shell corp constitutes “founding a company”, then I’d be the only founder of PayPal, since I filed the original incorporation docs for https://t.co/bOUOek5Cvy (later renamed PayPal), but that’s not what founding means.",506,8631,2022-04-21 08:12:03,"If filing a shell corp constitutes “founding a company”, then I’d be the only founder of PayPal, since I filed the original incorporation docs for  (later renamed PayPal), but that’s not what founding means.",0.5833333333333334,0.125,Positive
"@woonomic @VaibhavSisinty Not even close to that. It was a shell corp with no employees, no IP, no designs, no prototype, literally nothing but a biz plan to commercialize AC Propulsion’s Tzero car, which was introduced to me by JB Straubel, *not* Eberhard. 

Even name “Tesla Motors” was owned by others!",1324,17242,2022-04-21 08:09:07,"Not even close to that. It was a shell corp with no employees, no IP, no designs, no prototype, literally nothing but a biz plan to commercialize AC Propulsion’s Tzero car, which was introduced to me by JB Straubel, *not* Eberhard. Even name “Tesla Motors” was owned by others!",0.0,0.0,Neutral
"Please consider working at The Boring Company! 

Our goal is to solve traffic, which plagues every major city on Earth. https://t.co/1tHNhIo7sd",13482,169031,2022-04-21 03:09:12,"Please consider working at The Boring Company! Our goal is to solve traffic, which plagues every major city on Earth.",0.75,-0.46875,Negative
"@Erdayastronaut Hopefully, I didn’t say too many dumb things",845,27057,2022-04-21 03:07:01,"Hopefully, I didn’t say too many dumb things",0.5,0.0625,Positive
@WholeMarsBlog Tesla opex is embarrassingly high imo!,604,17196,2022-04-21 03:05:55,Tesla opex is embarrassingly high imo!,0.5399999999999999,0.2,Positive
@garyblack00 @MartinViecha $1T valuation with $0 advertising spend,5629,82993,2022-04-21 01:07:03,$1T valuation with $0 advertising spend,0.0,0.0,Neutral
@BillyM2k @nichegamer @slashdot Does it accurately portray software engineers?,402,6345,2022-04-20 18:47:57,Does it accurately portray software engineers?,0.6333333333333334,0.4000000000000001,Positive
@SawyerMerritt Yeah,459,10811,2022-04-20 18:44:56,Yeah,0.0,0.0,Neutral
@squawksquare @Pmgraham86 Yes,457,8187,2022-04-20 14:47:07,Yes,0.0,0.0,Neutral
@Teslarati @13ericralph31 Had to been done,1402,30932,2022-04-20 13:45:57,Had to been done,0.0,0.0,Neutral
_______ is the Night,17845,280342,2022-04-20 03:32:19,_______ is the Night,0.0,0.0,Neutral
@nichegamer @slashdot Can they please just make sci-fi/fantasy at least *mostly* about sci-fi/fantasy?,1317,17242,2022-04-20 03:11:43,Can they please just make sci-fi/fantasy at least *mostly* about sci-fi/fantasy?,0.45,0.1,Positive
@nichegamer @slashdot True,748,19977,2022-04-20 03:05:33,True,0.65,0.35,Positive
"@akheriaty I love Pinball Wizard!
https://t.co/h3psi9XFlT",697,16711,2022-04-20 02:52:29,I love Pinball Wizard!,0.6,0.625,Positive
@PPathole Absolutely,1192,30551,2022-04-20 02:47:40,Absolutely,0.9,0.2,Positive
@PPathole @slashdot Yes,1970,36254,2022-04-20 02:16:16,Yes,0.0,0.0,Neutral
@slashdot The woke mind virus is making Netflix unwatchable,47146,287975,2022-04-20 02:10:56,The woke mind virus is making Netflix unwatchable,0.0,0.0,Neutral
A social media platform’s policies are good if the most extreme 10% on left and right are equally unhappy,41950,491614,2022-04-19 18:25:05,A social media platform’s policies are good if the most extreme 10% on left and right are equally unhappy,0.5146258503401361,0.11343537414965986,Positive
@pmarca Extremely concerning. Who is pushing this censorship/deplatforming? Very shadowy.,9118,74382,2022-04-19 17:36:11,Extremely concerning. Who is pushing this censorship/deplatforming? Very shadowy.,0.65,0.037500000000000006,Positive
SpaceX Falcon team making great progress! Aiming for 5 day launch cadence with many performance &amp; refurb improvements.,11787,200145,2022-04-18 21:32:12,SpaceX Falcon team making great progress! Aiming for 5 day launch cadence with many performance &amp; refurb improvements.,0.625,0.75,Positive
"Why, thank you, sir!  https://t.co/tealJWLSdP",13045,164337,2022-04-18 14:15:38,"Why, thank you, sir!",0.0,0.0,Neutral
"@garyblack00 Board salary will be $0 if my bid succeeds, so that’s ~$3M/year saved right there",9603,68423,2022-04-18 14:09:23,"Board salary will be $0 if my bid succeeds, so that’s ~$3M/year saved right there",0.31785714285714284,0.4928571428571428,Positive
"@ICannot_Enough @jaylew333 Since he is consistently wrong, it should be possible to do quite well simply by doing the opposite of what he recommends",553,8196,2022-04-18 14:06:14,"Since he is consistently wrong, it should be possible to do quite well simply by doing the opposite of what he recommends",0.5642857142857143,-0.125,Negative
@TrungTPhan @TEDchris I feel it’s important that one’s hat also have a hat. Long-standing belief.,368,8332,2022-04-18 11:36:30,I feel it’s important that one’s hat also have a hat. Long-standing belief.,1.0,0.4,Positive
@teslaownersSV @Tesla I used to be such a snappy dresser!,1469,59589,2022-04-18 03:22:40,I used to be such a snappy dresser!,0.5,0.0,Neutral
@Erdayastronaut I think my clothes are too big for me,2043,79886,2022-04-18 03:21:42,I think my clothes are too big for me,0.1,0.0,Neutral
"@itsALLrisky @gigadgets_ I love it, sign me up",330,5725,2022-04-18 03:18:48,"I love it, sign me up",0.6,0.5,Positive
@gigadgets_ Sounds high,748,17675,2022-04-18 03:01:38,Sounds high,0.5399999999999999,0.16,Positive
@TEDchris I should probably stop cutting my own hair haha,639,14598,2022-04-18 01:10:49,I should probably stop cutting my own hair haha,0.7333333333333333,0.06666666666666667,Positive
@TEDchris Good interview,930,23831,2022-04-18 01:10:13,Good interview,0.6000000000000001,0.7,Positive
Happy Easter! https://t.co/3gBFlrPOQO,37579,585311,2022-04-17 21:09:42,Happy Easter!,1.0,1.0,Positive
Smooth landing video https://t.co/2K8Z80aB0u,16683,237291,2022-04-17 16:27:49,Smooth landing video,0.5,0.4,Positive
"@WholeMarsBlog Based on feedback received, we will drop mobile connector price to $200 &amp; make it easy to order with car. 

Note, mobile connector is not needed if you have a Tesla wall connector or to use Superchargers.

Recommend installing Tesla wall connector well before car arrives.",842,13009,2022-04-17 06:25:21,"Based on feedback received, we will drop mobile connector price to $200 &amp; make it easy to order with car. Note, mobile connector is not needed if you have a Tesla wall connector or to use Superchargers.Recommend installing Tesla wall connector well before car arrives.",0.8333333333333334,0.43333333333333335,Positive
"@WSBChairman In fairness to the Twitter board, this might be more of a concern about other potential bidders vs just me",2318,31731,2022-04-16 21:20:54,"In fairness to the Twitter board, this might be more of a concern about other potential bidders vs just me",0.625,0.125,Positive
"@WholeMarsBlog Usage statistics were super low, so seemed wasteful. On the (minor) plus side, we will be including more plug adapters with the mobile connector kit.",970,22786,2022-04-16 21:19:14,"Usage statistics were super low, so seemed wasteful. On the (minor) plus side, we will be including more plug adapters with the mobile connector kit.",0.41666666666666663,0.19583333333333333,Positive
🎶 Love Me Tender 🎶,24246,384227,2022-04-16 19:02:24, Love Me Tender ,0.6,0.5,Positive
"@ChrisJBakke Wow, with Jack departing, the Twitter board collectively owns almost no shares! Objectively, their economic interests are simply not aligned with shareholders.",25000,198324,2022-04-16 18:57:17,"Wow, with Jack departing, the Twitter board collectively owns almost no shares! Objectively, their economic interests are simply not aligned with shareholders.",0.4142857142857143,0.08125,Positive
