Tweets,Retweets,Likes,Date,Cleaned_Tweets,Subjectivity,Polarity,Sentiment
@WholeMarsBlog @jonbbc @aelluswamy 10.69.2 goes out to 100k owners next week,477,5908,2022-08-30 22:52:58,10.69.2 goes out to 100k owners next week,0.0,0.0,Neutral
@MuskUniversity SJM question,332,8741,2022-08-30 22:51:00,SJM question,0.0,0.0,Neutral
Spent the day walking entire Giga Berlin production line – team is doing excellent work!,5601,116093,2022-08-30 22:50:03,Spent the day walking entire Giga Berlin production line – team is doing excellent work!,0.5750000000000001,0.3,Positive
"@jonbbc @WholeMarsBlog @aelluswamy 10.69.1 is even better. We reduced latency &amp; jitter in hardware command loop, so time from object detection to brake actuation is 10% to 20% better.",462,7779,2022-08-30 22:47:31,"10.69.1 is even better. We reduced latency &amp; jitter in hardware command loop, so time from object detection to brake actuation is 10% to 20% better.",0.5,0.5,Positive
Kickass Internet connection coming Royal Caribbean ships soon! https://t.co/8qJRiUuNah,4948,66720,2022-08-30 22:38:14,Kickass Internet connection coming Royal Caribbean ships soon!,0.0,0.0,Neutral
@MuskUniversity It’s true,707,16390,2022-08-30 08:38:22,It’s true,0.65,0.35,Positive
@teslaownersSV @SpaceX Ancient times,843,26654,2022-08-30 08:38:06,Ancient times,0.0,0.0,Neutral
@teslaownersSV It will grow by at least 5 to 10 meters over time,1617,40534,2022-08-29 17:13:19,It will grow by at least 5 to 10 meters over time,0.4,-0.3,Negative
"@WholeMarsBlog First few days, just 1k owners, but going to 10k if no major issues. 

Note, 10.69.2, hopefully going out week after this, is the wide release beta.",586,8536,2022-08-29 02:18:35,"First few days, just 1k owners, but going to 10k if no major issues. Note, 10.69.2, hopefully going out week after this, is the wide release beta.",0.33333333333333337,-0.020312500000000004,Negative
@MuskUniversity Good to ask yourself this often,913,20408,2022-08-29 02:11:30,Good to ask yourself this often,0.6000000000000001,0.7,Positive
"@CSI_Starbase Agreed, we recently made this change &amp; many others.

An intense effort is underway to achieve robust engine containment in case of RUD to protect booster, other engines &amp; launch ring.",306,5472,2022-08-29 02:11:12,"Agreed, we recently made this change &amp; many others.An intense effort is underway to achieve robust engine containment in case of RUD to protect booster, other engines &amp; launch ring.",0.53125,0.14375,Positive
This will happen again – just a matter of time https://t.co/HeyZhZbAih,5360,55648,2022-08-28 23:51:49,This will happen again – just a matter of time,0.0,0.0,Neutral
Godspeed Artemis! https://t.co/8rZSQPamBf,4551,51664,2022-08-28 23:35:36,Godspeed Artemis!,0.0,0.0,Neutral
@RenataKonkoly @Kristennetten @culturaltutor The swoop of the X is meant to represent the rocket’s arc to orbit,194,3235,2022-08-28 22:54:36,The swoop of the X is meant to represent the rocket’s arc to orbit,0.0,0.0,Neutral
"@jonbbc Hopefully, this week",221,5269,2022-08-28 22:47:40,"Hopefully, this week",0.0,0.0,Neutral
"@Kristennetten @culturaltutor I somewhat agonized over the Tesla &amp; SpaceX font design (love fonts tbh). There are some similarities, particularly use of negative space. We’ve made many little tweaks over the years.",143,2488,2022-08-28 22:46:44,"I somewhat agonized over the Tesla &amp; SpaceX font design (love fonts tbh). There are some similarities, particularly use of negative space. We’ve made many little tweaks over the years.",0.4666666666666667,0.13583333333333333,Positive
@jgebbia Wise actions,617,14379,2022-08-28 22:42:28,Wise actions,0.9,0.7,Positive
@hubermanlab Diet Coke is amazing,1335,21220,2022-08-28 18:18:00,Diet Coke is amazing,0.9,0.6000000000000001,Positive
Please share some things in this thread which are working for you in life &amp; that others may find helpful!,4863,71034,2022-08-28 18:01:21,Please share some things in this thread which are working for you in life &amp; that others may find helpful!,0.0,0.0,Neutral
"@cb_doge @NorthmanTrader Yeah, I lift a little …",115,3103,2022-08-28 17:57:56,"Yeah, I lift a little …",0.5,-0.1875,Negative
@NorthmanTrader Over 20 lbs down from my (unhealthy) peak weight,117,4173,2022-08-28 17:56:12,Over 20 lbs down from my (unhealthy) peak weight,0.49444444444444446,-0.2777777777777778,Negative
"From time to time, I will share some things that seem to be working for me, in case you find it helpful",12862,207214,2022-08-28 17:54:13,"From time to time, I will share some things that seem to be working for me, in case you find it helpful",0.0,0.0,Neutral
The Zero fasting app is quite good,2082,45468,2022-08-28 17:40:56,The Zero fasting app is quite good,0.6000000000000001,0.7,Positive
"On advice of a good friend, I’ve been fasting periodically &amp; feel healthier",13128,200253,2022-08-28 17:40:02,"On advice of a good friend, I’ve been fasting periodically &amp; feel healthier",0.6000000000000001,0.7,Positive
"@nypost Yes, but I’ve done a lot with the place!",3442,132976,2022-08-28 17:35:19,"Yes, but I’ve done a lot with the place!",0.0,0.0,Neutral
@bullsunvalley @culturaltutor gnus news snooze,58,1232,2022-08-28 13:50:29,gnus news snooze,0.0,0.0,Neutral
@AGiovanni_1 @culturaltutor Coming,81,1665,2022-08-28 13:27:05,Coming,0.0,0.0,Neutral
@RenataKonkoly @culturaltutor Ares,58,1086,2022-08-28 13:26:40,Ares,0.0,0.0,Neutral
"@culturaltutor What do you call a Great Dane eating a small piece of ham in a tiny village?

Hamlet eating hamlet in a hamlet!

(Middle part credit to GAM)",190,2345,2022-08-28 13:22:40,What do you call a Great Dane eating a small piece of ham in a tiny village?Hamlet eating hamlet in a hamlet!(Middle part credit to GAM),0.5499999999999999,0.18333333333333335,Positive
Squeezing extra performance out of Falcon 9 – almost at 17 metric tons to an actual useful orbit with booster &amp; fairing reusable! https://t.co/vgHsmaSj7d,2607,35528,2022-08-28 05:29:11,Squeezing extra performance out of Falcon 9 – almost at 17 metric tons to an actual useful orbit with booster &amp; fairing reusable!,0.06666666666666667,0.125,Positive
@culturaltutor Maybe it’s times for new roman,2106,69003,2022-08-28 04:26:03,Maybe it’s times for new roman,0.45454545454545453,0.13636363636363635,Positive
@slashdot Getting to orbit &amp; back is harder than it may seem,681,12764,2022-08-28 04:22:40,Getting to orbit &amp; back is harder than it may seem,0.0,-0.05,Negative
@RenataKonkoly The caffeine one is most troubling,177,5009,2022-08-27 01:33:14,The caffeine one is most troubling,0.5,0.5,Positive
@SKMorefield Some are indeed sadly anti-human,591,13557,2022-08-26 23:40:47,Some are indeed sadly anti-human,1.0,-0.5,Negative
Countries should be increasing nuclear power generation! It is insane from a national security standpoint &amp; bad for the environment to shut them down.,35117,304961,2022-08-26 22:27:59,Countries should be increasing nuclear power generation! It is insane from a national security standpoint &amp; bad for the environment to shut them down.,0.6518518518518518,-0.6185185185185185,Negative
@teslaownersSV @ICannot_Enough LotR/HG2G,166,2983,2022-08-26 22:25:32,LotR/HG2G,0.0,0.0,Neutral
@ICannot_Enough It is safe to say that our output will not exceed the mass of the known universe,915,24144,2022-08-26 22:23:52,It is safe to say that our output will not exceed the mass of the known universe,0.5,0.5,Positive
"@ID_AA_Carmack Similarly high cycle life with nickel cathode is possible if optimizing for that.

Adding silicon to (primarily carbon) anode, which improves energy density, reduces cycle life, due to large volumetric changes during charge/discharge.",272,4868,2022-08-26 20:02:24,"Similarly high cycle life with nickel cathode is possible if optimizing for that.Adding silicon to (primarily carbon) anode, which improves energy density, reduces cycle life, due to large volumetric changes during charge/discharge.",0.5687142857142857,0.12985714285714287,Positive
@BillyM2k True,589,14729,2022-08-26 17:48:58,True,0.65,0.35,Positive
"@MatchasmMatt @jasondebolt @heydave7 That, plus pessimism about the future / false overpopulation fears",125,2388,2022-08-26 13:51:54,"That, plus pessimism about the future / false overpopulation fears",0.3625,-0.20000000000000004,Negative
@heydave7 Yes,172,6308,2022-08-26 13:50:27,Yes,0.0,0.0,Neutral
(And I do think global warming is a major risk),3124,73702,2022-08-26 04:31:43,(And I do think global warming is a major risk),0.25,0.03125,Positive
@teslaownersSV Yes,269,8736,2022-08-26 04:30:49,Yes,0.0,0.0,Neutral
Mark these words,3062,66285,2022-08-26 04:29:21,Mark these words,0.0,0.0,Neutral
Population collapse due to low birth rates is a much bigger risk to civilization than global warming,41143,355494,2022-08-26 04:27:02,Population collapse due to low birth rates is a much bigger risk to civilization than global warming,0.29375,-0.03125,Negative
@SciGuySpace Good summary,338,9893,2022-08-26 04:10:43,Good summary,0.6000000000000001,0.7,Positive
@teslaownersSV Yes,237,6284,2022-08-26 01:54:02,Yes,0.0,0.0,Neutral
@heydave7 Yes,364,10219,2022-08-26 01:39:38,Yes,0.0,0.0,Neutral
"Note, connectivity will be 2 to 4 Mbits per cell zone, so will work great for texting &amp; voice calls, but not high bandwidth",2952,49122,2022-08-26 00:42:37,"Note, connectivity will be 2 to 4 Mbits per cell zone, so will work great for texting &amp; voice calls, but not high bandwidth",0.645,0.36000000000000004,Positive
"Starlink V2, launching next year, will transmit direct to mobile phones, eliminating dead zones worldwide",20853,200175,2022-08-26 00:13:51,"Starlink V2, launching next year, will transmit direct to mobile phones, eliminating dead zones worldwide",0.26666666666666666,-0.03333333333333333,Negative
Livestream of big news in about an hour https://t.co/LSMIRYBxHH,2592,26800,2022-08-25 22:49:28,Livestream of big news in about an hour,0.1,0.0,Neutral
@teslaownersSV 10.69.1 releases Monday night. 10.69.2 about a week or so later – this will be the wide beta version.,833,13507,2022-08-25 19:39:08,10.69.1 releases Monday night. 10.69.2 about a week or so later – this will be the wide beta version.,0.2,-0.05,Negative
@SawyerMerritt @SpaceX Ron Barron is awesome,744,16349,2022-08-25 19:33:21,Ron Barron is awesome,1.0,1.0,Positive
@WholeMarsBlog @RealDanODowd 🦇 💩 crazy,334,5546,2022-08-25 16:29:50,  crazy,0.9,-0.6,Negative
"@BBC_Future I would gladly obey their commands, but I can’t tell what they’re saying!",792,14902,2022-08-24 20:22:34,"I would gladly obey their commands, but I can’t tell what they’re saying!",1.0,0.625,Positive
"@RationalEtienne @arctechinc I do not doubt that. Criticism, public or private, is welcome after we go to wide beta. 

Early beta has many known issues. The reason we release it to a limited number of cars is to discover unknown issues.",289,4018,2022-08-24 19:25:43,"I do not doubt that. Criticism, public or private, is welcome after we go to wide beta. Early beta has many known issues. The reason we release it to a limited number of cars is to discover unknown issues.",0.4105654761904762,0.14107142857142857,Positive
"@RationalEtienne @arctechinc No. Let me make something clear: James contacted me directly to be included in *early* beta, which is only ~1000 cars, mostly employees. 

Early beta explicitly has issues or it would be rolled out widely, so publicly criticizing something he had asked for is wrong.",347,5791,2022-08-24 18:28:39,"No. Let me make something clear: James contacted me directly to be included in *early* beta, which is only ~1000 cars, mostly employees. Early beta explicitly has issues or it would be rolled out widely, so publicly criticizing something he had asked for is wrong.",0.48124999999999996,0.05,Positive
This is something special https://t.co/LSMIRYT8zf,4305,43411,2022-08-24 16:31:54,This is something special,0.5714285714285714,0.35714285714285715,Positive
The course of civilization is not always upward https://t.co/8mr7pFWcnI,3194,34382,2022-08-24 07:28:13,The course of civilization is not always upward,0.0,0.0,Neutral
@heydave7 True,348,8768,2022-08-24 05:49:16,True,0.65,0.35,Positive
Mechazilla loads Starship on launchpad https://t.co/LfkfjpAcZj,11308,160971,2022-08-24 05:44:21,Mechazilla loads Starship on launchpad,0.0,0.0,Neutral
@arctechinc 10.69 is in limited release for a reason. Please do not ask to be included in early beta releases and then complain.,1190,32899,2022-08-23 19:17:56,10.69 is in limited release for a reason. Please do not ask to be included in early beta releases and then complain.,0.22142857142857142,0.01428571428571429,Positive
@spideycyp_155 !!,146,2653,2022-08-23 18:21:21,!!,0.0,0.0,Neutral
"So spam prevalence *was* shared with the board, but the board chose not disclose that to the public … https://t.co/lXk48TFZL1",3396,24777,2022-08-23 17:52:14,"So spam prevalence *was* shared with the board, but the board chose not disclose that to the public …",0.06666666666666667,0.0,Neutral
@andst7 Important thread,832,18427,2022-08-23 17:42:54,Important thread,1.0,0.4,Positive
@EvaFoxU In case anyone feels like buying a fine whistle …,268,5531,2022-08-23 16:19:17,In case anyone feels like buying a fine whistle …,0.5,0.4166666666666667,Positive
@AlliyahsimsTV Yet another “verified”🤖,159,2836,2022-08-23 15:54:35,Yet another “verified”,0.0,0.0,Neutral
@ID_AA_Carmack You’re waking up in the morning!?,105,2409,2022-08-23 15:50:28,You’re waking up in the morning!?,0.0,0.0,Neutral
Neuralink progress update show &amp; tell on October 31 st (Halloween),6828,96223,2022-08-22 06:57:42,Neuralink progress update show &amp; tell on October 31 st (Halloween),0.0,0.0,Neutral
"2 main goals this year: 

- Starship to orbit
- FSD wide release

Many other things, of course, but those are the 2 giant kahunas. Will require insane work by many super talented people, but, if anyone can do it, they can. 

It is an honor to work with such awesome human beings.",5808,75713,2022-08-22 06:55:01,"2 main goals this year: - Starship to orbit- FSD wide releaseMany other things, of course, but those are the 2 giant kahunas. Will require insane work by many super talented people, but, if anyone can do it, they can. It is an honor to work with such awesome human beings.",0.615909090909091,0.13409090909090907,Positive
It is the fastest way to get between one downtown and another with known physics (and the Standard Model is proving quiet resilient)!,994,16501,2022-08-22 06:44:02,It is the fastest way to get between one downtown and another with known physics (and the Standard Model is proving quiet resilient)!,0.16666666666666666,0.0,Neutral
Would be cool to do a (much simplified) Hyperloop demo tunnel between maybe Austin &amp; San Antonio?,1531,24602,2022-08-22 06:42:02,Would be cool to do a (much simplified) Hyperloop demo tunnel between maybe Austin &amp; San Antonio?,0.42500000000000004,0.275,Positive
Now @boringcompany tunnels are in active use in Vegas. Try it if you’re in town. Will be expanding to connect all major destinations in Vegas plus airport.,742,12085,2022-08-22 06:40:07,Now  tunnels are in active use in Vegas. Try it if you’re in town. Will be expanding to connect all major destinations in Vegas plus airport.,0.55,-0.035416666666666666,Negative
Funny how there are often simultaneous reactions saying “it’s impossible” and “it was already done 3000 years ago”,546,11373,2022-08-22 06:35:26,Funny how there are often simultaneous reactions saying “it’s impossible” and “it was already done 3000 years ago”,1.0,-0.20833333333333331,Negative
"@chazman @aelluswamy Glad it’s working out! Thanks for giving us this tough case to solve. That’s what field testing is all about.

This early version of 10.69 is being extra cautious, so waits for a moderately big gap in traffic to cross. Upcoming releases will do better in heavy traffic.",468,8207,2022-08-21 19:06:23,"Glad it’s working out! Thanks for giving us this tough case to solve. That’s what field testing is all about.This early version of 10.69 is being extra cautious, so waits for a moderately big gap in traffic to cross. Upcoming releases will do better in heavy traffic.",0.3925925925925926,0.09290123456790123,Positive
@chazman @aelluswamy Just wanted to emphasize again that our awesome Tesla software/AI team is who really deserves the credit. The talent level at Tesla is incredible.,1358,23842,2022-08-21 19:02:05,Just wanted to emphasize again that our awesome Tesla software/AI team is who really deserves the credit. The talent level at Tesla is incredible.,0.7000000000000001,0.7000000000000001,Positive
"Note, you can upgrade your existing car to FSD in 2 mins via the Tesla app",1608,25428,2022-08-21 14:41:54,"Note, you can upgrade your existing car to FSD in 2 mins via the Tesla app",0.0,0.0,Neutral
"After wide release of FSD Beta 10.69.2, price of FSD will rise to $15k in North America on September 5th. 

Current price will be honored for orders made before Sept 5th, but delivered later.",3152,39517,2022-08-21 14:40:36,"After wide release of FSD Beta 10.69.2, price of FSD will rise to $15k in North America on September 5th. Current price will be honored for orders made before Sept 5th, but delivered later.",0.26666666666666666,-0.03333333333333333,Negative
"FSD Beta 10.69 started rolling out to Tesla owners last night. This build is a big step forward!

10.69.1 probably end of week with wider release.

1069.2 in a few weeks should be good enough to provide to all FSD Beta participants.",2087,24289,2022-08-21 14:34:21,FSD Beta 10.69 started rolling out to Tesla owners last night. This build is a big step forward!10.69.1 probably end of week with wider release.1069.2 in a few weeks should be good enough to provide to all FSD Beta participants.,0.2733333333333333,0.09999999999999999,Positive
"@BLKMDL3 @Tesla Tesla Autopilot/AI team did great work with 10.69! Some point releases needed for polish, so 10.69.2 should really shine.",808,14565,2022-08-21 12:41:06,"Tesla Autopilot/AI team did great work with 10.69! Some point releases needed for polish, so 10.69.2 should really shine.",0.475,0.6,Positive
@aelluswamy Worth hearing about Tesla Autopilot software/AI progress,497,9880,2022-08-21 01:04:46,Worth hearing about Tesla Autopilot software/AI progress,0.1,0.3,Positive
"@WholeMarsBlog As mentioned previously, this is a major release, so we need to be cautious. Goes out to ~1000 Beta participants later today.",355,5320,2022-08-20 17:43:15,"As mentioned previously, this is a major release, so we need to be cautious. Goes out to ~1000 Beta participants later today.",0.2222222222222222,-0.03472222222222222,Negative
Might need a new PO Box after tweeting this 🤣,2567,89501,2022-08-19 20:57:21,Might need a new PO Box after tweeting this ,0.45454545454545453,0.13636363636363635,Positive
"Nice letter from Bill Nix, who would’ve been my prof at Stanford if I hadn’t put grad studies on (permanent) deferment https://t.co/ioq0mGwN7K",7671,151289,2022-08-19 20:07:52,"Nice letter from Bill Nix, who would’ve been my prof at Stanford if I hadn’t put grad studies on (permanent) deferment",1.0,0.6,Positive
"@SpaceX Each fairing half is a fully capable reentry vehicle with its own thrusters, thermal protection, avionics &amp; sensor suite",1078,17221,2022-08-19 19:34:41,"Each fairing half is a fully capable reentry vehicle with its own thrusters, thermal protection, avionics &amp; sensor suite",0.5222222222222223,0.2111111111111111,Positive
@Dilbert_Daily Free Willy was never free 😢,753,14260,2022-08-19 14:25:53,Free Willy was never free ,0.8,0.1,Positive
Still so grateful 🥹 https://t.co/EhdyXw4fqN,31457,562247,2022-08-19 06:04:54,Still so grateful ,0.0,0.0,Neutral
"@teslaownersSV @CChomp13 There are many major code changes, so this will be an extra cautious rollout.

Releasing on 8/20 to ~1000 Tesla owners, then 10.69.1 next week to accommodate feedback &amp; release to ~10k customers, then 10.69.2 week after &amp; release to rest of FSD Beta.",415,4536,2022-08-19 05:46:00,"There are many major code changes, so this will be an extra cautious rollout.Releasing on 8/20 to ~1000 Tesla owners, then 10.69.1 next week to accommodate feedback &amp; release to ~10k customers, then 10.69.2 week after &amp; release to rest of FSD Beta.",0.275,0.140625,Positive
@CChomp13 Entropy,516,11508,2022-08-19 05:28:59,Entropy,0.0,0.0,Neutral
@Andst7 Those are the questions that Twitter is doing everything possible to avoid answering …,281,3071,2022-08-18 20:19:01,Those are the questions that Twitter is doing everything possible to avoid answering …,1.0,0.0,Neutral
"@SawyerMerritt @ICannot_Enough Modifying your car after delivery is legal in America, so yes 😀",251,4633,2022-08-18 20:16:36,"Modifying your car after delivery is legal in America, so yes ",0.2,0.2,Positive
"@ICannot_Enough That said, we will add autoconfigure to side mirrors",195,4196,2022-08-18 16:51:06,"That said, we will add autoconfigure to side mirrors",0.0,0.0,Neutral
@ICannot_Enough Side mirrors cause ~5% range reduction at highway speed,237,4254,2022-08-18 15:56:39,Side mirrors cause ~5% range reduction at highway speed,0.0,0.0,Neutral
"@ICannot_Enough Yes, but side mirrors won’t be needed in a self-driving future",1110,33877,2022-08-18 15:53:55,"Yes, but side mirrors won’t be needed in a self-driving future",0.125,0.0,Neutral
"@RationalEtienne @MuskUniversity For some reason, I just agree with that guy so much!",158,3811,2022-08-17 14:59:16,"For some reason, I just agree with that guy so much!",0.2,0.25,Positive
🎶 This Magic Moment 🎶,5958,94874,2022-08-17 09:22:09, This Magic Moment ,1.0,0.5,Positive
@Kristennetten @wonderofscience *shall,93,2317,2022-08-17 08:48:41,*shall,0.0,0.0,Neutral
@Kristennetten @wonderofscience I will seek out one of these “Mars Bars” tomorrow!,177,3693,2022-08-17 08:48:00,I will seek out one of these “Mars Bars” tomorrow!,0.0,0.0,Neutral
Being a Mom is just as important as any career,80201,732927,2022-08-17 08:44:21,Being a Mom is just as important as any career,1.0,0.4,Positive
Highly Recommend https://t.co/nrDZ4gJqEE,1562,23833,2022-08-17 08:08:12,Highly Recommend,0.5399999999999999,0.16,Positive
"@wonderofscience Mercury, the forbidden candy",958,39127,2022-08-17 07:49:25,"Mercury, the forbidden candy",0.0,0.0,Neutral
@MuskUniversity Yes,363,13897,2022-08-17 07:34:39,Yes,0.0,0.0,Neutral
"@Elon_Quotes_ Almost all of Earth’s energy comes from the sun already – we would be a dark iceball at near absolute zero if not for the sun. And essentially the entire ecosystem is solar-powered.

Civilization uses a tiny amount of energy by comparison. Not hard to generate from wind/solar.",884,10933,2022-08-17 07:29:58,Almost all of Earth’s energy comes from the sun already – we would be a dark iceball at near absolute zero if not for the sun. And essentially the entire ecosystem is solar-powered.Civilization uses a tiny amount of energy by comparison. Not hard to generate from wind/solar.,0.5238095238095238,0.04226190476190477,Positive
"@teslaownersSV Although, if it were any team, it would be Man U. They were my fav team as a kid.",5945,51844,2022-08-17 05:09:23,"Although, if it were any team, it would be Man U. They were my fav team as a kid.",0.0,0.0,Neutral
@BillyM2k no u,340,10532,2022-08-17 05:02:11,no u,0.0,0.0,Neutral
Standup is my side-hustle,8866,155973,2022-08-17 04:59:51,Standup is my side-hustle,0.0,0.0,Neutral
"@teslaownersSV And I’m not buying Coca-Cola to put the cocaine back in, despite the extreme popularity of such a move",1567,19541,2022-08-17 04:56:28,"And I’m not buying Coca-Cola to put the cocaine back in, despite the extreme popularity of such a move",0.5,-0.041666666666666664,Negative
"@teslaownersSV No, this is a long-running joke on Twitter. I’m not buying any sports teams.",11097,108521,2022-08-17 04:34:45,"No, this is a long-running joke on Twitter. I’m not buying any sports teams.",0.0,0.0,Neutral
@WholeMarsBlog @karpathy Got to build those YouTube subscriptions!,458,14176,2022-08-17 00:26:00,Got to build those YouTube subscriptions!,0.0,0.0,Neutral
"@EvaFoxU Note, we are trying to reduce delivery times as quickly as possible. Long wait times are not a good thing.",477,9918,2022-08-17 00:14:44,"Note, we are trying to reduce delivery times as quickly as possible. Long wait times are not a good thing.",0.6666666666666666,-0.13333333333333333,Negative
"@realginnyrobins Yeah, that’s what I mean",445,15923,2022-08-17 00:05:25,"Yeah, that’s what I mean",0.6875,-0.3125,Negative
"Also, I’m buying Manchester United ur welcome",119775,885729,2022-08-17 00:01:46,"Also, I’m buying Manchester United ur welcome",0.9,0.8,Positive
@Grimezsz The downside of elf ear surgery probably outweighs the upside,496,18835,2022-08-17 00:00:36,The downside of elf ear surgery probably outweighs the upside,0.0,0.0,Neutral
"To be clear, I support the left half of the Republican Party and the right half of the Democratic Party!",21042,366615,2022-08-16 23:56:43,"To be clear, I support the left half of the Republican Party and the right half of the Democratic Party!",0.25047619047619046,0.0021428571428571464,Positive
@yangliuxh @ZichenWanghere Reasonably accurate translation,195,4330,2022-08-16 23:52:55,Reasonably accurate translation,0.6333333333333334,0.4000000000000001,Positive
@WholeMarsBlog 🤣 ok we’ll turn it on,617,16998,2022-08-16 17:29:52, ok we’ll turn it on,0.5,0.5,Positive
@teslaownersSV Yes. Tesla Autopilot/AI team is doing amazing work! 10.69 will be worth its name.,1258,21392,2022-08-15 23:33:24,Yes. Tesla Autopilot/AI team is doing amazing work! 10.69 will be worth its name.,0.5,0.525,Positive
